# DOCS_TEST: example_001

statement ok
CREATE TABLE t1 AS SELECT * FROM (VALUES
    (1, 1, 10, 100, 1, 2, 3, 1, 2, 3, 1, 1, 1, 1, 1, 1, 1, 'Intro to Search', 'search analytics body', 'search content', 'alien galaxy film', 'alpha', 'search', 'engineering', 'sci-fi', 'north', 'US', 'Berlin', 'widget', 'Alice', 'open', 'AAPL', 100, 10, 9.5e0, 4200, 120, 2024, 1000, 70000, 1, 500, 1, 42, DATE '2025-01-15', TIMESTAMP '2025-01-15 10:00:00', TIMESTAMP '2025-01-16 10:00:00', DATE '2025-01-15', DATE '2025-01-15', TIMESTAMP '2025-01-15 10:00:00', TIMESTAMP '2025-01-15 10:00:00', 1, 1, 1, 1, 10, 100e0, 5e-2, 1e-2, 'N', 'O', DATE '1998-09-01', DATE '1998-08-15', DATE '1998-09-05', 'DELIVER IN PERSON', 'AIR', 'first lineitem'),
    (2, 2, 20, 200, 2, 3, 4, 2, 3, 4, 2, 2, 2, 2, 2, 2, 2, 'Scaling Analytics', 'another text body', 'analytics content', 'biggest blockbuster story', 'beta', 'analytics', 'product', 'drama', 'south', 'DE', 'Paris', 'gadget', 'Bob', 'closed', 'MSFT', 200, 20, 19.5e0, 5100, 95, 2025, 2500, 80000, 2, 700, 2, 84, DATE '2025-03-01', TIMESTAMP '2025-03-01 11:00:00', TIMESTAMP '2025-03-02 11:00:00', DATE '2025-03-01', DATE '2025-03-01', TIMESTAMP '2025-03-01 11:00:00', TIMESTAMP '2025-03-01 11:00:00', 2, 2, 2, 2, 20, 200e0, 1e-1, 2e-2, 'R', 'F', DATE '1998-09-02', DATE '1998-08-16', DATE '1998-09-06', 'TAKE BACK RETURN', 'MAIL', 'second lineitem')
) AS t(id, i, j, k, x, y, z, a, b, c, article_id, comment_id, author_id, customer_id, order_id, product_id, employee_id, title, body, content, description, name, tag, category, genre, region, country, city, product, customer, status, symbol, amount, quantity, price, views, runtime, year, revenue, salary, grade, balance, count, value, published_at, created_at, updated_at, date, sale_date, ts, time, l_orderkey, l_partkey, l_suppkey, l_linenumber, l_quantity, l_extendedprice, l_discount, l_tax, l_returnflag, l_linestatus, l_shipdate, l_commitdate, l_receiptdate, l_shipinstruct, l_shipmode, l_comment);

control substitution on

statement ok
USE $__DATABASE__;

statement ok
CREATE TABLE tbl (
    id INTEGER,
    name VARCHAR,
    col1 DOUBLE,
    col2 DOUBLE,
    "Some Column Name" VARCHAR,
    i INTEGER,
    j INTEGER,
    a INTEGER,
    b INTEGER,
    c INTEGER,
    number INTEGER,
    number1 INTEGER,
    number2 INTEGER
);

statement ok
INSERT INTO tbl VALUES
    (1, 'mark', 1, 2, 'alpha', 1, 10, 10, 20, 30, 10, 100, 1000),
    (3, 'bookmark', 4, 5, 'beta', 2, 20, 11, 21, 31, 20, 200, 2000),
    (7, 'other', 9, 16, 'gamma', 3, 30, 12, 22, 32, NULL, 300, 3000);

# DOCS_TEST_BODY

query
SELECT * FROM tbl;
----
id	name	col1	col2	Some Column Name	i	j	a	b	c	number	number1	number2
1	mark	1	2	alpha	1	10	10	20	30	10	100	1000
3	bookmark	4	5	beta	2	20	11	21	31	20	200	2000
7	other	9	16	gamma	3	30	12	22	32	NULL	300	3000

# DOCS_TEST: example_002

# DOCS_TEST_BODY

query
SELECT j FROM tbl WHERE i = 3;
----
j
30

# DOCS_TEST: example_003

# DOCS_TEST_BODY

query ?? rowsort
SELECT i, sum(j) FROM tbl GROUP BY i;
----
i	sum
1	10
2	20
3	30

# DOCS_TEST: example_004

# DOCS_TEST_BODY

query
SELECT * FROM tbl ORDER BY i DESC LIMIT 3;
----
id	name	col1	col2	Some Column Name	i	j	a	b	c	number	number1	number2
7	other	9	16	gamma	3	30	12	22	32	NULL	300	3000
3	bookmark	4	5	beta	2	20	11	21	31	20	200	2000
1	mark	1	2	alpha	1	10	10	20	30	10	100	1000

# DOCS_TEST: example_005

statement ok
DROP TABLE IF EXISTS t2;

statement ok
CREATE TABLE t2 (a INTEGER, b INTEGER);

statement ok
INSERT INTO t2 VALUES
    (1, 2),
    (2, 3);

# DOCS_TEST_BODY

query ??????????????????????????????????????????????????????????????????? rowsort
SELECT * FROM t1 JOIN t2 USING (a, b);
----
a	b	id	i	j	k	x	y	z	c	article_id	comment_id	author_id	customer_id	order_id	product_id	employee_id	title	body	content	description	name	tag	category	genre	region	country	city	product	customer	status	symbol	amount	quantity	price	views	runtime	year	revenue	salary	grade	balance	count	value	published_at	created_at	updated_at	date	sale_date	ts	time	l_orderkey	l_partkey	l_suppkey	l_linenumber	l_quantity	l_extendedprice	l_discount	l_tax	l_returnflag	l_linestatus	l_shipdate	l_commitdate	l_receiptdate	l_shipinstruct	l_shipmode	l_comment
1	2	1	1	10	100	1	2	3	3	1	1	1	1	1	1	1	Intro to Search	search analytics body	search content	alien galaxy film	alpha	search	engineering	sci-fi	north	US	Berlin	widget	Alice	open	AAPL	100	10	9.5	4200	120	2024	1000	70000	1	500	1	42	2025-01-15	2025-01-15 10:00:00	2025-01-16 10:00:00	2025-01-15	2025-01-15	2025-01-15 10:00:00	2025-01-15 10:00:00	1	1	1	1	10	100	0.05	0.01	N	O	1998-09-01	1998-08-15	1998-09-05	DELIVER IN PERSON	AIR	first lineitem
2	3	2	2	20	200	2	3	4	4	2	2	2	2	2	2	2	Scaling Analytics	another text body	analytics content	biggest blockbuster story	beta	analytics	product	drama	south	DE	Paris	gadget	Bob	closed	MSFT	200	20	19.5	5100	95	2025	2500	80000	2	700	2	84	2025-03-01	2025-03-01 11:00:00	2025-03-02 11:00:00	2025-03-01	2025-03-01	2025-03-01 11:00:00	2025-03-01 11:00:00	2	2	2	2	20	200	0.1	0.02	R	F	1998-09-02	1998-08-16	1998-09-06	TAKE BACK RETURN	MAIL	second lineitem

# DOCS_TEST: example_006

# DOCS_TEST_BODY

query
SELECT #1, #3 FROM tbl;
----
id	col1
1	1
3	4
7	9

# DOCS_TEST: example_007

statement ok
USE $__DATABASE__;

statement ok
CREATE TABLE addresses (
    address VARCHAR,
    city VARCHAR,
    street_name VARCHAR,
    income DOUBLE,
    zip VARCHAR,
    country VARCHAR,
    population INTEGER,
    number1 INTEGER,
    number2 INTEGER
);

statement ok
INSERT INTO addresses VALUES
    ('123 Maple Blvd', 'Springfield', 'Maple Blvd', 50000, '11111', 'NL', 100, 1, 10),
    ('111 Oak Lane', 'Springfield', 'Oak Lane', 60000, '11111', 'NL', 100, 2, 20),
    ('111 Oak Lane', 'Riverton', 'Oak Lane', 70000, '11111', 'US', 50, 3, 30),
    ('111 Oak Lane', 'Riverton', 'Oak Lane', 80000, '11111-0001', 'US', 50, 4, 40),
    ('5 Pond Road', 'Lakeside', 'Pond Road', 90000, '22222', 'UK', 25, 5, 50),
    ('9 Lake View', 'Lakeside', 'Lake View', 40000, '33333', 'UK', 25, 6, 60);

# DOCS_TEST_BODY

query ? rowsort
SELECT DISTINCT city FROM addresses;
----
city
Lakeside
Riverton
Springfield

# DOCS_TEST: example_008

# DOCS_TEST_BODY

query
SELECT d
FROM (SELECT 1 AS a, 2 AS b) d;
----
d
(1,2)

# DOCS_TEST: example_009

# DOCS_TEST_RAW
#| SELECT ⟨select_list⟩
#| FROM ⟨tables⟩
#|     USING SAMPLE ⟨sample_expression⟩
#| WHERE ⟨condition⟩
#| GROUP BY ⟨groups⟩
#| HAVING ⟨group_filter⟩
#|     WINDOW ⟨window_expression⟩
#|     QUALIFY ⟨qualify_filter⟩
#| ORDER BY ⟨order_expression⟩
#| LIMIT ⟨n⟩;

# DOCS_TEST_BODY

# DOCS_TEST: example_010

# DOCS_TEST_BODY

statement ok
CREATE TABLE t (id INTEGER, content VARCHAR);

statement ok
INSERT INTO t VALUES (42, 'hello'), (43, 'world');

query
SELECT rowid, id, content FROM t;
----
rowid	id	content
0	42	hello
1	43	world

# DOCS_TEST: example_011

statement ok
USE $__DATABASE__;

statement ok
DROP TABLE IF EXISTS t;

# DOCS_TEST_BODY

statement ok
CREATE OR REPLACE TABLE t AS (FROM range(10) r(i));

statement ok
DELETE FROM t WHERE i % 2 = 0;

query
SELECT rowid FROM t;
----
rowid
1
3
5
7
9
