
# Explicit rocksdb -- equivalent to default.
statement ok
CREATE TABLE storage_rocks (a INTEGER PRIMARY KEY, b TEXT)
  WITH (storage = 'rocksdb');

statement ok
DROP TABLE storage_rocks;


# Headline smoke: kSearch shard creates iresearch directory + empty writer,
# dtor closes cleanly, drop wipes the directory.
statement ok
CREATE TABLE storage_search (a INTEGER PRIMARY KEY, b TEXT)
  WITH (storage = 'search');

statement ok
DROP TABLE storage_search;


statement ok
CREATE TABLE storage_search_upper (a INTEGER PRIMARY KEY, b TEXT)
  WITH (storage = 'SEARCH');

statement ok
DROP TABLE storage_search_upper;


# Two search tables coexist in the same schema (independent directories).
statement ok
CREATE TABLE storage_search_a (a INTEGER PRIMARY KEY, b TEXT)
  WITH (storage = 'search');

statement ok
CREATE TABLE storage_search_b (a INTEGER PRIMARY KEY, b TEXT)
  WITH (storage = 'search');

statement ok
DROP TABLE storage_search_a;

statement ok
DROP TABLE storage_search_b;


statement error
CREATE TABLE storage_err1 (a INTEGER PRIMARY KEY)
  WITH (storage = 'invalid_storage_type');
----
db error: ERROR: WITH option "storage" must be 'rocksdb' or 'search', got "invalid_storage_type"


statement error
CREATE TABLE storage_err2 (a INTEGER PRIMARY KEY)
  WITH (storage = ['search']);
----
db error: ERROR: WITH option "storage" expects a string literal


statement ok
CREATE TABLE search_dml (a INTEGER PRIMARY KEY, b TEXT)
  WITH (storage = 'search');

statement ok
INSERT INTO search_dml VALUES (1, 'x'), (2, 'y'), (3, 'z');


statement ok
VACUUM (REFRESH_TABLE) search_dml;


query
SELECT * FROM search_dml ORDER BY a;
----
a	b
1	x
2	y
3	z


# COUNT(*) uses the count-only scan path (no real columns projected); it must
# return the row count, not error on the virtual column.
query
SELECT COUNT(*) FROM search_dml;
----
count
3


query
SELECT COUNT(*) FROM search_dml WHERE a >= 2;
----
count
2


statement error
UPDATE search_dml SET b = 'y' WHERE a = 1;
----
db error: ERROR: UPDATE on a search-backed table is not yet supported


# DELETE removes rows by PK term; the removal is visible after the publish
# (VACUUM REFRESH_TABLE), like inserts.
statement ok
DELETE FROM search_dml WHERE a = 1;

statement ok
VACUUM (REFRESH_TABLE) search_dml;

query
SELECT a, b FROM search_dml ORDER BY a;
----
a	b
2	y
3	z


query
SELECT COUNT(*) FROM search_dml;
----
count
2


statement error
TRUNCATE search_dml;
----
db error: ERROR: TRUNCATE on a search-backed table is not yet supported


# All access methods rejected (including USING inverted -- iresearch on
# top of iresearch makes no sense).
statement error
CREATE INDEX search_dml_idx ON search_dml (b);
----
db error: ERROR: CREATE INDEX on a search-backed table is not yet supported


statement error
CREATE INDEX search_dml_inv_idx ON search_dml USING inverted (b);
----
db error: ERROR: CREATE INDEX on a search-backed table is not yet supported


statement ok
DROP TABLE search_dml;


## Generated-PK search table -- INSERT path reserves the sequence range
statement ok
CREATE TABLE search_genpk (a INTEGER, b TEXT) WITH (storage = 'search');

statement ok
INSERT INTO search_genpk VALUES (10, 'p'), (20, 'q'), (30, 'r');

statement ok
VACUUM (REFRESH_TABLE) search_genpk;

query
SELECT * FROM search_genpk ORDER BY a;
----
a	b
10	p
20	q
30	r

# DELETE on a generated-PK table: the rowid is the synthetic PK, materialised
# from the stored kGeneratedPKId column for row identity.
statement ok
DELETE FROM search_genpk WHERE a >= 20;

statement ok
VACUUM (REFRESH_TABLE) search_genpk;

query
SELECT * FROM search_genpk ORDER BY a;
----
a	b
10	p

statement ok
DROP TABLE search_genpk;


statement ok
CREATE TABLE search_ctas WITH (storage = 'search') AS
  SELECT * FROM (VALUES (1, 'a'), (2, 'b'), (3, 'c')) AS t(x, y);

statement ok
VACUUM (REFRESH_TABLE) search_ctas;

query
SELECT * FROM search_ctas ORDER BY x;
----
x	y
1	a
2	b
3	c

statement ok
DROP TABLE search_ctas;


statement ok
BEGIN;

statement ok
CREATE TABLE search_multi WITH (storage = 'search') AS
  SELECT * FROM (VALUES (1, 'even'), (2, 'odd'), (3, 'even'), (4, 'odd'))
    AS t(id, grp);

statement ok
INSERT INTO search_multi VALUES (10, 'even'), (11, 'odd'), (12, 'even');

statement ok
INSERT INTO search_multi VALUES (20, 'even');

statement ok
COMMIT;

statement ok
VACUUM (REFRESH_TABLE) search_multi;


query
SELECT id, grp FROM search_multi ORDER BY id;
----
id	grp
1	even
2	odd
3	even
4	odd
10	even
11	odd
12	even
20	even


query
SELECT id FROM search_multi WHERE grp = 'even' ORDER BY id;
----
id
1
3
10
12
20

statement ok
DROP TABLE search_multi;
