control substitution on

# DOCS_TEST: example_001

# DOCS_TEST_BODY

statement ok
CREATE TABLE weather (
    city    VARCHAR,
    temp_lo INTEGER, -- minimum temperature on a day
    temp_hi INTEGER, -- maximum temperature on a day
    prcp    FLOAT,
    date    DATE
);

# DOCS_TEST: example_002

# DOCS_TEST_BODY

statement ok
CREATE TABLE cities (
    name VARCHAR,
    lat  DOUBLE,
    lon  DOUBLE
);

# DOCS_TEST: example_003

statement ok
CREATE TABLE tablename (id INTEGER);

# DOCS_TEST_BODY

statement ok
DROP TABLE tablename;

# DOCS_TEST: example_004

# DOCS_TEST_BODY

statement ok
INSERT INTO weather
VALUES ('San Francisco', 46, 50, 0.25, '1994-11-27');

# DOCS_TEST: example_005

# DOCS_TEST_BODY

statement ok
INSERT INTO cities
VALUES ('San Francisco', -194.0, 53.0);

# DOCS_TEST: example_006

# DOCS_TEST_BODY

statement ok
INSERT INTO weather (city, temp_lo, temp_hi, prcp, date)
VALUES ('San Francisco', 43, 57, 0.0, '1994-11-29');

# DOCS_TEST: example_007

# DOCS_TEST_BODY

statement ok
INSERT INTO weather (date, city, temp_hi, temp_lo)
VALUES ('1994-11-29', 'Hayward', 54, 37);

# DOCS_TEST: example_008

statement ok
COPY (SELECT * FROM (VALUES
    ('Oakland', 45, 58, 0.1, DATE '1994-11-30')
) AS t("city", "temp_lo", "temp_hi", "prcp", "date")) TO '/tmp/${__DATABASE__}_sql_introduction_example_008_1_weather_csv.csv' (FORMAT CSV, HEADER false, DELIMITER ',');

# DOCS_TEST_RAW
#| COPY weather
#| FROM 'weather.csv';

# DOCS_TEST_BODY

statement ok
COPY weather
FROM '/tmp/${__DATABASE__}_sql_introduction_example_008_1_weather_csv.csv';

# DOCS_TEST: example_009

# DOCS_TEST_BODY

query
SELECT *
FROM weather;
----
city	temp_lo	temp_hi	prcp	date
San Francisco	46	50	0.25	1994-11-27
San Francisco	43	57	0	1994-11-29
Hayward	37	54	NULL	1994-11-29
Oakland	45	58	0.1	1994-11-30

# DOCS_TEST: example_010

# DOCS_TEST_BODY

query
SELECT city, temp_lo, temp_hi, prcp, date
FROM weather;
----
city	temp_lo	temp_hi	prcp	date
San Francisco	46	50	0.25	1994-11-27
San Francisco	43	57	0	1994-11-29
Hayward	37	54	NULL	1994-11-29
Oakland	45	58	0.1	1994-11-30

# DOCS_TEST: example_011

# DOCS_TEST_BODY

query
SELECT city, (temp_hi + temp_lo) / 2 AS temp_avg, date
FROM weather;
----
city	temp_avg	date
San Francisco	48	1994-11-27
San Francisco	50	1994-11-29
Hayward	45	1994-11-29
Oakland	51	1994-11-30

# DOCS_TEST: example_012

# DOCS_TEST_BODY

query
SELECT *
FROM weather
WHERE city = 'San Francisco'
  AND prcp > 0.0;
----
city	temp_lo	temp_hi	prcp	date
San Francisco	46	50	0.25	1994-11-27

# DOCS_TEST: example_013

# DOCS_TEST_BODY

query
SELECT *
FROM weather
ORDER BY city;
----
city	temp_lo	temp_hi	prcp	date
Hayward	37	54	NULL	1994-11-29
Oakland	45	58	0.1	1994-11-30
San Francisco	46	50	0.25	1994-11-27
San Francisco	43	57	0	1994-11-29

# DOCS_TEST: example_014

# DOCS_TEST_BODY

query
SELECT *
FROM weather
ORDER BY city, temp_lo;
----
city	temp_lo	temp_hi	prcp	date
Hayward	37	54	NULL	1994-11-29
Oakland	45	58	0.1	1994-11-30
San Francisco	43	57	0	1994-11-29
San Francisco	46	50	0.25	1994-11-27

# DOCS_TEST: example_015

# DOCS_TEST_BODY

query ? rowsort
SELECT DISTINCT city
FROM weather;
----
city
Hayward
Oakland
San Francisco

# DOCS_TEST: example_016

# DOCS_TEST_BODY

query
SELECT DISTINCT city
FROM weather
ORDER BY city;
----
city
Hayward
Oakland
San Francisco

# DOCS_TEST: example_017

statement ok
DELETE FROM cities;

statement ok
INSERT INTO cities
VALUES ('San Francisco', -194.0, 53.0);

# DOCS_TEST_BODY

query
SELECT *
FROM weather, cities
WHERE city = name;
----
city	temp_lo	temp_hi	prcp	date	name	lat	lon
San Francisco	46	50	0.25	1994-11-27	San Francisco	-194	53
San Francisco	43	57	0	1994-11-29	San Francisco	-194	53

# DOCS_TEST: example_018

statement ok
DELETE FROM cities;

statement ok
INSERT INTO cities
VALUES ('San Francisco', -194.0, 53.0);

# DOCS_TEST_BODY

query
SELECT city, temp_lo, temp_hi, prcp, date, lon, lat
FROM weather, cities
WHERE city = name;
----
city	temp_lo	temp_hi	prcp	date	lon	lat
San Francisco	46	50	0.25	1994-11-27	53	-194
San Francisco	43	57	0	1994-11-29	53	-194

# DOCS_TEST: example_019

statement ok
DELETE FROM cities;

statement ok
INSERT INTO cities
VALUES ('San Francisco', -194.0, 53.0);

# DOCS_TEST_BODY

query
SELECT weather.city, weather.temp_lo, weather.temp_hi,
       weather.prcp, weather.date, cities.lon, cities.lat
FROM weather, cities
WHERE cities.name = weather.city;
----
city	temp_lo	temp_hi	prcp	date	lon	lat
San Francisco	46	50	0.25	1994-11-27	53	-194
San Francisco	43	57	0	1994-11-29	53	-194

# DOCS_TEST: example_020

statement ok
DELETE FROM cities;

statement ok
INSERT INTO cities
VALUES ('San Francisco', -194.0, 53.0);

# DOCS_TEST_BODY

query
SELECT *
FROM weather
INNER JOIN cities ON weather.city = cities.name;
----
city	temp_lo	temp_hi	prcp	date	name	lat	lon
San Francisco	46	50	0.25	1994-11-27	San Francisco	-194	53
San Francisco	43	57	0	1994-11-29	San Francisco	-194	53

# DOCS_TEST: example_021

statement ok
DELETE FROM cities;

statement ok
INSERT INTO cities
VALUES ('San Francisco', -194.0, 53.0);

# DOCS_TEST_BODY

query
SELECT *
FROM weather
LEFT OUTER JOIN cities ON weather.city = cities.name;
----
city	temp_lo	temp_hi	prcp	date	name	lat	lon
San Francisco	46	50	0.25	1994-11-27	San Francisco	-194	53
San Francisco	43	57	0	1994-11-29	San Francisco	-194	53
Hayward	37	54	NULL	1994-11-29	NULL	NULL	NULL
Oakland	45	58	0.1	1994-11-30	NULL	NULL	NULL

# DOCS_TEST: example_022

# DOCS_TEST_BODY

query
SELECT max(temp_lo)
FROM weather;
----
max
46

# DOCS_TEST: example_023

# DOCS_TEST_BODY

query error
SELECT city
FROM weather
WHERE temp_lo = max(temp_lo);
----
db error: ERROR: WHERE clause cannot contain aggregates!


# DOCS_TEST: example_024

# DOCS_TEST_BODY

query
SELECT city
FROM weather
WHERE temp_lo = (SELECT max(temp_lo) FROM weather);
----
city
San Francisco

# DOCS_TEST: example_025

# DOCS_TEST_BODY

query ?? rowsort
SELECT city, max(temp_lo)
FROM weather
GROUP BY city;
----
city	max
Hayward	37
Oakland	45
San Francisco	46

# DOCS_TEST: example_026

# DOCS_TEST_BODY

query ?? rowsort
SELECT city, max(temp_lo)
FROM weather
GROUP BY city
HAVING max(temp_lo) < 40;
----
city	max
Hayward	37

# DOCS_TEST: example_027

# DOCS_TEST_BODY

query ?? rowsort
SELECT city, max(temp_lo)
FROM weather
WHERE city LIKE 'S%'            -- (1)
GROUP BY city
HAVING max(temp_lo) < 40;
----
city	max

# DOCS_TEST: example_028

# DOCS_TEST_BODY

statement ok
UPDATE weather
SET temp_hi = temp_hi - 2,  temp_lo = temp_lo - 2
WHERE date > '1994-11-28';

# DOCS_TEST: example_029

# DOCS_TEST_BODY

query
SELECT *
FROM weather;
----
city	temp_lo	temp_hi	prcp	date
San Francisco	46	50	0.25	1994-11-27
San Francisco	41	55	0	1994-11-29
Hayward	35	52	NULL	1994-11-29
Oakland	43	56	0.1	1994-11-30

# DOCS_TEST: example_030

# DOCS_TEST_BODY

statement ok
DELETE FROM weather
WHERE city = 'Hayward';

# DOCS_TEST: example_031

# DOCS_TEST_BODY

query
SELECT *
FROM weather;
----
city	temp_lo	temp_hi	prcp	date
San Francisco	46	50	0.25	1994-11-27
San Francisco	41	55	0	1994-11-29
Oakland	43	56	0.1	1994-11-30

# DOCS_TEST: example_032

statement ok
CREATE TABLE table_name (id INTEGER);

# DOCS_TEST_BODY

statement ok
DELETE FROM table_name;
