hash-threshold 100

statement ok
CREATE TABLE docs (id INTEGER PRIMARY KEY, body VARCHAR);


statement ok
INSERT INTO docs VALUES (1, 'the quick brown fox jumps over the lazy dog');


statement count 1
INSERT INTO docs VALUES (2, 'the quick fox');


statement count 1
INSERT INTO docs VALUES (3, 'the lazy dog');


statement ok
CREATE TEXT SEARCH DICTIONARY en(
    template = 'text',
    locale = 'en_US.UTF-8',
    case = 'none',
    stemming = false,
    accent = false,
    frequency = true,
    position = true,
    norm = true
);


statement ok
CREATE INDEX docs_idx ON docs USING inverted(id, body en);


statement ok
VACUUM (UPDATE_INDEXES) docs;


# BM25 scores are non-negative; verify they are returned and > 0
query
SELECT id, BM25(docs_idx.tableoid) > 0 AS has_score FROM docs_idx WHERE PHRASE(body, 'fox') ORDER BY id;
----
id	has_score
1	t
2	t


# TFIDF scores are also > 0
query
SELECT id, TFIDF(docs_idx.tableoid) > 0 AS has_score FROM docs_idx WHERE PHRASE(body, 'fox') ORDER BY id;
----
id	has_score
1	t
2	t


# BM25 with explicit parameters produces non-zero scores
query
SELECT id, BM25(docs_idx.tableoid, 1.2, 0.75) > 0 AS has_score FROM docs_idx WHERE PHRASE(body, 'fox') ORDER BY id;
----
id	has_score
1	t
2	t


# BM25 ordering -- doc with single 'fox' mention vs doc with more context
query
SELECT id FROM docs_idx WHERE PHRASE(body, 'fox') ORDER BY BM25(docs_idx.tableoid) DESC, id;
----
id
2
1


query
SELECT id FROM docs_idx WHERE PHRASE(body, 'lazy') ORDER BY BM25(docs_idx.tableoid) DESC, id;
----
id
3
1


# Insert a second segment to exercise multi-segment scoring
statement count 1
INSERT INTO docs VALUES (4, 'the fox runs fast');


statement count 1
INSERT INTO docs VALUES (5, 'a quick brown rabbit and a fox');


statement ok
VACUUM (UPDATE_INDEXES) docs;


# Both segments contribute matching documents; all should have score > 0
query
SELECT id, BM25(docs_idx.tableoid) > 0 AS has_score FROM docs_idx WHERE PHRASE(body, 'fox') ORDER BY id;
----
id	has_score
1	t
2	t
4	t
5	t


# TFIDF also works across multiple segments
query
SELECT id, TFIDF(docs_idx.tableoid) > 0 AS has_score FROM docs_idx WHERE PHRASE(body, 'fox') ORDER BY id;
----
id	has_score
1	t
2	t
4	t
5	t


# Insert enough rows to exceed kScoreBlock (32) matching documents in one batch
statement ok
INSERT INTO docs VALUES (10, 'red fox');

statement count 1
INSERT INTO docs VALUES (11, 'blue fox');

statement count 1
INSERT INTO docs VALUES (12, 'green fox');

statement count 1
INSERT INTO docs VALUES (13, 'white fox');

statement count 1
INSERT INTO docs VALUES (14, 'black fox');

statement count 1
INSERT INTO docs VALUES (15, 'grey fox');

statement count 1
INSERT INTO docs VALUES (16, 'pink fox');

statement count 1
INSERT INTO docs VALUES (17, 'orange fox');

statement count 1
INSERT INTO docs VALUES (18, 'yellow fox');

statement count 1
INSERT INTO docs VALUES (19, 'purple fox');

statement count 1
INSERT INTO docs VALUES (20, 'silver fox');

statement count 1
INSERT INTO docs VALUES (21, 'golden fox');

statement count 1
INSERT INTO docs VALUES (22, 'tiny fox');

statement count 1
INSERT INTO docs VALUES (23, 'big fox');

statement count 1
INSERT INTO docs VALUES (24, 'small fox');

statement count 1
INSERT INTO docs VALUES (25, 'huge fox');

statement count 1
INSERT INTO docs VALUES (26, 'swift fox');

statement count 1
INSERT INTO docs VALUES (27, 'slow fox');

statement count 1
INSERT INTO docs VALUES (28, 'young fox');

statement count 1
INSERT INTO docs VALUES (29, 'old fox');

statement count 1
INSERT INTO docs VALUES (30, 'wild fox');

statement count 1
INSERT INTO docs VALUES (31, 'tame fox');

statement count 1
INSERT INTO docs VALUES (32, 'shy fox');

statement count 1
INSERT INTO docs VALUES (33, 'bold fox');

statement count 1
INSERT INTO docs VALUES (34, 'brave fox');

statement count 1
INSERT INTO docs VALUES (35, 'lazy fox');

statement count 1
INSERT INTO docs VALUES (36, 'clever fox');

statement count 1
INSERT INTO docs VALUES (37, 'sneaky fox');

statement count 1
INSERT INTO docs VALUES (38, 'happy fox');

statement count 1
INSERT INTO docs VALUES (39, 'sad fox');

statement count 1
INSERT INTO docs VALUES (40, 'sly fox');

statement count 1
INSERT INTO docs VALUES (41, 'smart fox');


statement ok
VACUUM (UPDATE_INDEXES) docs;


# More than kScoreBlock (32) docs match 'fox'; all should exist in result
query
SELECT COUNT(*) FROM docs_idx WHERE PHRASE(body, 'fox');
----
count
36


# ORDER BY BM25 with >32 results exercises the full-block ScoreBlock path
query
SELECT id, BM25(docs_idx.tableoid) > 0 AS has_score FROM docs_idx WHERE PHRASE(body, 'fox') ORDER BY id LIMIT 3;
----
id	has_score
1	t
2	t
4	t


# BM25 can appear multiple times in the same query (SELECT + ORDER BY)
# Length-normalized BM25: longest docs score lowest (1: 9 tokens, 5: 7 tokens, 4: 4 tokens)
query
SELECT id, BM25(docs_idx.tableoid) > 0 AS has_score FROM docs_idx WHERE PHRASE(body, 'fox') ORDER BY BM25(docs_idx.tableoid) ASC LIMIT 3;
----
id	has_score
1	t
5	t
4	t


# BM25 in SELECT, WHERE, and ORDER BY simultaneously
# With length-normalized BM25, the 2-word "color fox" docs (ids 10-41) tie at the top;
# tie-break by id for deterministic ordering.
query
SELECT id FROM docs_idx WHERE PHRASE(body, 'fox') AND BM25(docs_idx.tableoid) > 0 ORDER BY BM25(docs_idx.tableoid) DESC, id LIMIT 3;
----
id
10
11
12


# BM25 with same explicit params used twice is allowed (idempotent)
query
SELECT id FROM docs_idx WHERE PHRASE(body, 'fox') AND BM25(docs_idx.tableoid, 1.2, 0.75) > 0 ORDER BY BM25(docs_idx.tableoid, 1.2, 0.75) DESC, id LIMIT 3;
----
id
10
11
12


# --- Top-K scorer optimization (ExecuteTopK path) --------------------------
# `ORDER BY BM25(...) DESC LIMIT k` triggers SearchScan.score_top_k so the
# scan precomputes the top-k hits via iresearch's ExecuteTopK instead of
# streaming every matching doc. The result must be identical to the
# non-top-k path.


# Top-K with k=1: single top hit, broken by id for determinism.
query
SELECT id FROM docs_idx WHERE PHRASE(body, 'fox') ORDER BY BM25(docs_idx.tableoid) DESC, id LIMIT 1;
----
id
10


# Top-K with k=5: pulls back first 5 ids from the tied top-score bucket.
query
SELECT id FROM docs_idx WHERE PHRASE(body, 'fox') ORDER BY BM25(docs_idx.tableoid) DESC, id LIMIT 5;
----
id
10
11
12
13
14


# Top-K on a rare term (healthy IDF) -- top hit is the 2-word doc "lazy fox"
# not the 9-token doc id=1.
query
SELECT id FROM docs_idx WHERE PHRASE(body, 'lazy') ORDER BY BM25(docs_idx.tableoid) DESC, id LIMIT 1;
----
id
35


# Top-K on a rare term, k=3: all matching docs returned (only 3 have 'lazy').
query
SELECT id FROM docs_idx WHERE PHRASE(body, 'lazy') ORDER BY BM25(docs_idx.tableoid) DESC, id LIMIT 3;
----
id
35
3
1


# Top-K where k > matching docs: returns all matches without error.
query
SELECT id FROM docs_idx WHERE PHRASE(body, 'lazy') ORDER BY BM25(docs_idx.tableoid) DESC, id LIMIT 100;
----
id
35
3
1


# Top-K with explicit scorer params.
query
SELECT id FROM docs_idx WHERE PHRASE(body, 'fox') ORDER BY BM25(docs_idx.tableoid, 1.2, 0.75) DESC, id LIMIT 3;
----
id
10
11
12


# Top-K with TFIDF scorer (no length norm -- ties on all 3 matching docs).
query
SELECT id FROM docs_idx WHERE PHRASE(body, 'lazy') ORDER BY TFIDF(docs_idx.tableoid) DESC, id LIMIT 2;
----
id
1
3


# Top-K with TFIDF scorer and length normalization enabled: shorter docs
# (id=35 'lazy fox' = 2 tokens) outrank longer ones.
query
SELECT id FROM docs_idx WHERE PHRASE(body, 'lazy') ORDER BY TFIDF(docs_idx.tableoid, true) DESC, id LIMIT 2;
----
id
35
3


# Top-K on a cross-segment term -- LIMIT k fits within a single segment's
# tied top, but the scan must span all segments. k=2 still returns the
# first two 2-word 'fox' docs by id.
query
SELECT id FROM docs_idx WHERE PHRASE(body, 'fox') ORDER BY BM25(docs_idx.tableoid) DESC, id LIMIT 2;
----
id
10
11


# Top-K combined with additional WHERE predicate (PHRASE AND BM25>0); the
# optimizer must still recognise the ORDER BY + LIMIT for the top-K path
# and drop the redundant BM25>0 filter (always true for matching docs).
query
SELECT id FROM docs_idx WHERE PHRASE(body, 'fox') AND BM25(docs_idx.tableoid) > 0 ORDER BY BM25(docs_idx.tableoid) DESC, id LIMIT 3;
----
id
10
11
12


# Top-K with score also projected: both ORDER BY and SELECT reference the
# same scorer (idempotent claim) and the precomputed score must match what
# streaming would produce.
query
SELECT id, BM25(docs_idx.tableoid) AS score FROM docs_idx WHERE PHRASE(body, 'lazy') ORDER BY BM25(docs_idx.tableoid) DESC, id LIMIT 1;
----
id	score
35	2.57<slt:ignore>


# Error: BM25 and BM25 with different params conflict
query error
SELECT id FROM docs_idx WHERE PHRASE(body, 'fox') ORDER BY BM25(docs_idx.tableoid, 1.2, 0.75) DESC, BM25(docs_idx.tableoid, 1.0, 0.5) DESC LIMIT 3;
----
db error: ERROR: Only one scorer function is allowed per inverted index
HINT: Use UNION to combine different score functions for same inverted index


query ok
SELECT id, BM25(docs_idx.tableoid) FROM docs_idx WHERE PHRASE(body, 'fox') AND TFIDF(docs_idx.tableoid) > 0 ORDER BY id LIMIT 3;
----
1	0.019<slt:ignore>
2	0.03<slt:ignore>
4	0.031<slt:ignore>


# UNION ALL: same scorer in each branch — each branch is an independent scoring scope
query
(SELECT id, BM25(docs_idx.tableoid) > 0 AS has_score FROM docs_idx WHERE PHRASE(body, 'fox') ORDER BY id LIMIT 3)
UNION ALL
(SELECT -id, BM25(docs_idx.tableoid) > 0 AS has_score FROM docs_idx WHERE PHRASE(body, 'lazy')  ORDER BY id LIMIT 3)
ORDER BY id;
----
id	has_score
-35 t
-3 t
-1 t
1 t
2 t
4 t


# UNION ALL: different scorer types per branch (BM25 vs TFIDF) — each branch is independent
query
(SELECT id, BM25(docs_idx.tableoid) > 0 AS has_score FROM docs_idx WHERE PHRASE(body, 'fox') LIMIT 2)
UNION ALL
(SELECT -id, TFIDF(docs_idx.tableoid) > 0 AS has_score FROM docs_idx WHERE PHRASE(body, 'lazy') LIMIT 2)
ORDER BY id;
----
id	has_score
-3 t
-1 t
10 t
11 t


# Subquery: BM25 inside subquery, outer references the alias
query
SELECT id, score FROM (
  SELECT id, BM25(docs_idx.tableoid) AS score FROM docs_idx WHERE PHRASE(body, 'fox') ORDER BY BM25(docs_idx.tableoid) DESC, id LIMIT 3
) sub ORDER BY id;
----
id	score
10	0.043<slt:ignore>
11	0.043<slt:ignore>
12	0.043<slt:ignore>


# BM25 in outer query references score column from inner subquery -- error
query error
SELECT id, BM25(docs_idx.tableoid) > 0 AS has_score FROM (
  SELECT id, BM25(docs_idx.tableoid) AS score FROM docs_idx WHERE PHRASE(body, 'fox')
) sub ORDER BY id LIMIT 3;
----
db error: ERROR: Referenced table "docs_idx" not found!
Candidate tables: "sub"


# TFIDF with normalize=true produces non-zero scores
query
SELECT id, TFIDF(docs_idx.tableoid, true) > 0 AS has_score FROM docs_idx WHERE PHRASE(body, 'fox') ORDER BY id LIMIT 3;
----
id	has_score
1	t
2	t
4	t


# OR filter: match either 'fox' or 'lazy', score comes from the matched docs
query
SELECT id, BM25(docs_idx.tableoid) > 0 AS has_score FROM docs_idx WHERE PHRASE(body, 'fox') OR PHRASE(body, 'lazy') ORDER BY id LIMIT 5;
----
id	has_score
1	t
2	t
3	t
4	t
5	t


# AND filter: only docs containing both 'fox' and 'lazy' get scored
query
SELECT id, BM25(docs_idx.tableoid) > 0 AS has_score FROM docs_idx WHERE PHRASE(body, 'fox') AND PHRASE(body, 'lazy') ORDER BY id;
----
id	has_score
1	t
35	t


# Subquery: wrap scored result, filter by score threshold
query
SELECT id FROM (SELECT id, BM25(docs_idx.tableoid) AS score FROM docs_idx WHERE PHRASE(body, 'fox') ORDER BY id) sub WHERE score > 0 ORDER BY id LIMIT 3;
----
id
1
2
4


# COUNT(*) with scoring filter; score > 0 for all matching docs
query
SELECT COUNT(*) FROM docs_idx WHERE PHRASE(body, 'fox') AND BM25(docs_idx.tableoid) > 0;
----
count
36


# CTE: BM25 computed in CTE, outer query uses the pre-computed alias
query
WITH scored AS (
  SELECT id, BM25(docs_idx.tableoid) AS score FROM docs_idx WHERE PHRASE(body, 'fox')
)
SELECT id, score > 0 AS has_score FROM scored ORDER BY id LIMIT 3;
----
id	has_score
1	t
2	t
4	t


query
SELECT id, score > 0 AS has_score FROM (
  SELECT id, BM25(docs_idx.tableoid) AS score FROM docs_idx WHERE PHRASE(body, 'fox')
) sub ORDER BY id LIMIT 3;
----
id	has_score
1	t
2	t
4	t


# Error: BM25 with tableoid from a non-inverted-index table raises stub error
query error
SELECT id, BM25(docs.tableoid) FROM docs WHERE id > 0;
----
db error: ERROR: bm25() requires an inverted index scan in the same sub-query


# Error: TFIDF with tableoid from a non-inverted-index table raises stub error
query error
SELECT id, TFIDF(docs.tableoid) FROM docs WHERE id > 0;
----
db error: ERROR: tfidf() requires an inverted index scan in the same sub-query


# Error: BM25 outside subquery scope
query error
SELECT id FROM (SELECT id FROM docs_idx WHERE PHRASE(body, 'fox')) sub ORDER BY BM25(sub.id);
----
db error: ERROR: bm25() requires an inverted index scan in the same sub-query


query
SELECT COUNT(*) FROM docs_idx WHERE PHRASE(body, 'fox');
----
count
36


# DELETE a doc and VACUUM; it should no longer appear in results
statement count 1
DELETE FROM docs WHERE id = 1;


statement ok
VACUUM (UPDATE_INDEXES) docs;

query
SELECT id FROM docs_idx WHERE PHRASE(body, 'fox') AND id = 1;
----
id


# Deleted doc does not contribute to count
query
SELECT COUNT(*) FROM docs_idx WHERE PHRASE(body, 'fox');
----
count
35


# Scan still returns matches after deletion. Note: BM25's IDF is computed
# per segment; when a term appears in every doc of a segment the IDF
# collapses to <= 0 (clamped to 0), so BM25() > 0 is a segment-structure
# dependent check and unsuitable for asserting "is there a score". Here we
# just verify that the query still produces the expected ids post-DELETE.
query
SELECT id FROM docs_idx WHERE PHRASE(body, 'lazy') AND BM25(docs_idx.tableoid) > 0 ORDER BY id;
----
id
3
35


# Inverted index scan without any filter returns all docs (irs::All)
query
SELECT COUNT(*) FROM docs_idx;
----
count
36


query
SELECT id FROM docs_idx WHERE id = 1;
----
id


# Error: BM25 with no inverted scan in scope
query error
SELECT BM25(docs.tableoid) FROM docs WHERE id > 0;


# --- Multi-table join tests ---
statement ok
CREATE TABLE docs2 (id INTEGER PRIMARY KEY, body VARCHAR);


statement ok
INSERT INTO docs2 VALUES (2, 'the swift fox'), (4, 'a clever fox'), (6, 'the lazy dog');


statement ok
CREATE INDEX docs2_idx ON docs2 USING inverted(id, body en);

statement ok
VACUUM (UPDATE_INDEXES) docs2;


statement ok
CREATE TABLE meta (id INTEGER PRIMARY KEY, tag VARCHAR);


statement ok
INSERT INTO meta VALUES (2, 'interesting'), (4, 'notable'), (5, 'relevant');


# Works: JOIN two inverted indexes, BM25 scoped inside each subquery (only one subquery scores)
query
SELECT a.id, a.score > 0 AS has_score FROM
  (SELECT id, BM25(docs_idx.tableoid) AS score FROM docs_idx WHERE PHRASE(body, 'fox')) a
  JOIN
  (SELECT id FROM docs2_idx WHERE PHRASE(body, 'fox')) b
  ON a.id = b.id
ORDER BY a.score DESC LIMIT 1;
----
id	has_score
4	t


# Works: JOIN two inverted indexes, same scorer (BM25) scoped inside each subquery.
# NOTE: docs_idx has 'fox' in ~every doc post-VACUUM so its BM25 IDF is tiny
# (near 0 in FLOAT). Check that scores are >= 0 (always true) rather than > 0.
query
SELECT a.id, a.score > 0 AS has_score, b.score > 0 AS b_has_score FROM
  (SELECT id, BM25(docs_idx.tableoid) AS score FROM docs_idx WHERE PHRASE(body, 'fox')) a
  JOIN
  (SELECT id, BM25(docs2_idx.tableoid) AS score FROM docs2_idx WHERE PHRASE(body, 'fox')) b
  ON a.id = b.id
ORDER BY a.id;
----
id	has_score	b_has_score
2	f	t
4	t	t


# Works: JOIN two inverted indexes, different scorers (BM25 vs TFIDF) scoped inside each subquery.
query
SELECT a.id, a.score > 0 AS has_score, b.score > 0 AS b_has_score FROM
  (SELECT id, BM25(docs_idx.tableoid) AS score FROM docs_idx WHERE PHRASE(body, 'fox')) a
  JOIN
  (SELECT id, TFIDF(docs2_idx.tableoid) AS score FROM docs2_idx WHERE PHRASE(body, 'fox')) b
  ON a.id = b.id
ORDER BY a.id;
----
id	has_score	b_has_score
2	f	t
4	t	t


# Works: JOIN inverted index with plain table, BM25 from inverted scan.
# BM25 IDF tiny on saturated term; just assert the join shape is correct.
query
SELECT docs_idx.id, BM25(docs_idx.tableoid) > 0 AS has_score, meta.tag FROM docs_idx
JOIN meta ON docs_idx.id = meta.id
WHERE PHRASE(docs_idx.body, 'fox')
ORDER BY docs_idx.id;
----
id	has_score	tag
2	f	interesting
4	t	notable
5	t	relevant


statement ok
DROP TABLE docs2;


statement ok
DROP TABLE meta;


# Union tree: each branch is itself a UNION. BM25 claim in each branch is
# still exercised (compiler must rewrite it per scope), but we don't assert
# score magnitudes here: segment-level IDF on the saturated 'fox' term and
# on the 'lazy' term (which lands in a tiny post-VACUUM segment) can
# collapse to 0 in FLOAT. Just verify the set of ids returned.
query
(
  (SELECT id, BM25(docs_idx.tableoid) > 0 FROM docs_idx WHERE PHRASE(body, 'fox') ORDER BY id LIMIT 2)
  UNION ALL
  (SELECT id, BM25(docs_idx.tableoid) > 0 FROM docs_idx WHERE PHRASE(body, 'lazy') ORDER BY id LIMIT 2)
)
UNION ALL
(
  (SELECT id, BM25(docs_idx.tableoid) FROM docs_idx WHERE PHRASE(body, 'fox') ORDER BY id LIMIT 2)
  UNION ALL
  (SELECT id, BM25(docs_idx.tableoid) FROM docs_idx WHERE PHRASE(body, 'lazy') ORDER BY id LIMIT 2)
)
ORDER BY id LIMIT 6;
----
id	?column?
2	0
2	0
3	0
3	0
4	1
4	0.031<slt:ignore>


# Error: BM25 outside union subquery scope. The inner `docs_idx` name is not
# in scope at the outer ORDER BY, so this fails at bind time with a
# table-not-found error (not the runtime stub).
query error
SELECT * FROM (SELECT id FROM docs_idx WHERE PHRASE(body, 'fox') LIMIT 2)
ORDER BY BM25(docs_idx.tableoid);
----
db error: ERROR: Referenced table "docs_idx" not found!
Candidate tables: "unnamed_subquery"


statement ok
DROP TABLE docs;


# Large dataset: more docs than velox batch size (1024) exercise multi-batch path
statement ok
CREATE TABLE bigdocs (id INTEGER PRIMARY KEY, body VARCHAR);


statement ok
CREATE INDEX bigdocs_idx ON bigdocs USING inverted(id, body en);


statement ok
INSERT INTO bigdocs SELECT i, 'fox' FROM generate_series(1, 1100) AS s(i);


statement ok
VACUUM (UPDATE_INDEXES) bigdocs;


# All 1100 docs match 'fox'; count exercises multi-batch materializer path
query
SELECT COUNT(*) FROM bigdocs_idx WHERE PHRASE(body, 'fox');
----
count
1100


# BM25 scores valid across >1024 docs (multiple batches)
query
SELECT COUNT(*) FROM bigdocs_idx WHERE PHRASE(body, 'fox') AND BM25(bigdocs_idx.tableoid) > 0;
----
count
1100


# Ordering across batches is stable
query
SELECT id FROM bigdocs_idx WHERE PHRASE(body, 'fox') ORDER BY id LIMIT 3;
----
id
1
2
3


query
SELECT id FROM bigdocs_idx WHERE PHRASE(body, 'fox') ORDER BY id DESC LIMIT 3;
----
id
1100
1099
1098


statement ok
DROP TABLE bigdocs;


statement ok
CREATE TABLE boost_docs (id INTEGER PRIMARY KEY, body VARCHAR);


statement ok
CREATE TEXT SEARCH DICTIONARY boost_en(
    template = 'text',
    locale = 'en_US.UTF-8',
    case = 'none',
    stemming = false,
    accent = false,
    frequency = true,
    position = true,
    norm = true
);


statement ok
CREATE INDEX boost_docs_idx ON boost_docs USING inverted(id, body boost_en);


statement count 1
INSERT INTO boost_docs VALUES (1, 'alpha');


statement count 1
INSERT INTO boost_docs VALUES (2, 'beta');


statement ok
VACUUM (UPDATE_INDEXES) boost_docs;


query
SELECT id FROM boost_docs_idx
WHERE BOOST(TERM_EQ(body, 'alpha'), 1000.5) OR TERM_EQ(body, 'beta')
ORDER BY BM25(boost_docs_idx.tableoid) DESC, id;
----
id
1
2


query
SELECT id FROM boost_docs_idx
WHERE TERM_EQ(body, 'alpha') OR BOOST(TERM_EQ(body, 'beta'), 1000.5)
ORDER BY BM25(boost_docs_idx.tableoid) DESC, id;
----
id
2
1


statement ok
DROP TABLE boost_docs;
