hash-threshold 100

statement ok
CREATE TABLE foo (a INTEGER PRIMARY KEY, b VARCHAR, c VARCHAR);

statement ok
CREATE INDEX foo_idx ON foo USING inverted(a, b, c);

statement ok
INSERT INTO foo values (1, 'quick brown fox jumps over lazy dog', 'value a');

statement ok
INSERT INTO foo values (2, 'quick red fox jumps over lazy dog', 'value a');

statement ok
INSERT INTO foo values (3, 'quick red fox jumps over big dog', 'value a');

statement ok
INSERT INTO foo values (4, 'quick brown fox jumps over big dog', 'value b');

statement ok
VACUUM (UPDATE_INDEXES) foo;

query
SELECT a, b FROM foo_idx WHERE PHRASE(b, 'over big dog') OR PHRASE(b, 'red fox') ORDER BY a;
----
a	b
2	quick red fox jumps over lazy dog
3	quick red fox jumps over big dog
4	quick brown fox jumps over big dog

query
SELECT a, b FROM foo_idx WHERE PHRASE(b, 'over big dog') OR a = 1 ORDER BY a;
----
a	b
1	quick brown fox jumps over lazy dog
3	quick red fox jumps over big dog
4	quick brown fox jumps over big dog

query
SELECT a, b, c FROM foo_idx WHERE PHRASE(c, 'value b') AND PHRASE(b, 'over big dog');
----
a	b	c
4	quick brown fox jumps over big dog	value b


statement ok
UPDATE foo SET c = 'value abc' WHERE a = 3;

statement ok
VACUUM (UPDATE_INDEXES) foo;

query
SELECT a, b, c FROM foo_idx WHERE PHRASE(c, 'value abc') AND PHRASE(b, 'over big dog');
----
a	b	c
3	quick red fox jumps over big dog	value abc

statement ok
DROP TABLE foo;

statement count 100000
CREATE TABLE clickclack AS
SELECT
  CASE
    WHEN vedernikoff_team.crook % 2 = 0 THEN 
      'team member vedernikoff has ' || (crook / 10)::text || ' stocks'
    ELSE 
      'team member cutelooked has ' || (boss * 1000)::text || ' stocks'
  END AS fact
FROM
  generate_series(1, 1000) as vedernikoff_team(crook),
  generate_series(1, 100) as cutelooked_team(boss);

statement ok
CREATE INDEX clickclack_facts ON clickclack USING inverted(fact);

query
SELECT * FROM clickclack_facts WHERE PHRASE(fact, 'team member');
----

query
SELECT * FROM clickclack_facts WHERE PHRASE(fact, 'vedernikoff has');
----

query
SELECT * FROM clickclack_facts WHERE PHRASE(fact, 'cutelooked has');
----

query
SELECT * FROM clickclack_facts WHERE PHRASE(fact, 'has 0 stocks');
----

statement ok
DROP TABLE clickclack;

statement ok
CREATE TABLE clickclack_pk (fact TEXT PRIMARY KEY, detail TEXT);

statement count 10000
INSERT INTO clickclack_pk
SELECT
  CASE
    WHEN rn % 2 = 0 THEN
      'team member vedernikoff has ' || rn::text || ' stocks'
    ELSE
      'team member cutelooked has ' || rn::text || ' stocks'
  END AS fact,
  CASE
    WHEN rn % 2 = 0 THEN
      'vedernikoff row ' || rn::text
    ELSE
      'cutelooked row ' || rn::text
  END AS detail
FROM
  generate_series(1, 10000) AS s(rn);

statement ok
CREATE INDEX clickclack_pk_facts ON clickclack_pk USING inverted(fact, detail);

query
SELECT * FROM clickclack_pk_facts WHERE PHRASE(fact, 'team member') ORDER BY fact;
----

query
SELECT * FROM clickclack_pk_facts WHERE PHRASE(fact, 'vedernikoff has') ORDER BY fact;
----

query
SELECT * FROM clickclack_pk_facts WHERE PHRASE(fact, 'cutelooked has') ORDER BY fact;
----

query
SELECT * FROM clickclack_pk_facts WHERE PHRASE(fact, 'has 0 stocks') ORDER BY fact;
----

query
SELECT * FROM clickclack_pk_facts WHERE PHRASE(detail, 'vedernikoff row') ORDER BY fact;
----

query
SELECT * FROM clickclack_pk_facts WHERE PHRASE(detail, 'cutelooked row') ORDER BY fact;
----

statement ok
DROP TABLE clickclack_pk;
