statement ok
CREATE TABLE foo (a INTEGER PRIMARY KEY, b VARCHAR, c VARCHAR);

statement ok
CREATE INDEX foo_idx ON foo USING inverted(a, b, c);

statement ok
INSERT INTO foo values (1, 'quick brown fox jumps over lazy dog', 'value a');

statement ok
INSERT INTO foo values (2, 'quick red fox jumps over lazy dog', 'value a');

statement ok
INSERT INTO foo values (3, 'quick red fox jumps over big dog', 'value a');

statement ok
INSERT INTO foo values (4, 'quick brown fox jumps over big dog', 'value b');

statement ok
VACUUM (UPDATE_INDEXES) foo;

query
SELECT a, b FROM foo_idx WHERE PHRASE(b, 'over big dog') OR PHRASE(b, 'red fox') ORDER BY a;
----
a	b
2	quick red fox jumps over lazy dog
3	quick red fox jumps over big dog
4	quick brown fox jumps over big dog

query
SELECT a, b FROM foo_idx WHERE PHRASE(b, 'over big dog') OR a = 1 ORDER BY a;
----
a	b
1	quick brown fox jumps over lazy dog
3	quick red fox jumps over big dog
4	quick brown fox jumps over big dog

query
SELECT a, b, c FROM foo_idx WHERE PHRASE(c, 'value b') AND PHRASE(b, 'over big dog');
----
a	b	c
4	quick brown fox jumps over big dog	value b


statement ok
UPDATE foo SET c = 'value abc' WHERE a = 3;

statement ok
VACUUM (UPDATE_INDEXES) foo;

query
SELECT a, b, c FROM foo_idx WHERE PHRASE(c, 'value abc') AND PHRASE(b, 'over big dog');
----
a	b	c
3	quick red fox jumps over big dog	value abc

statement ok
DROP TABLE foo;


statement count 100000
CREATE TABLE clickclack AS
SELECT
  CASE
    WHEN vedernikoff_team.crook % 2 = 0 THEN 
      'team member vedernikoff has ' || (crook / 10)::text || ' stocks'
    ELSE 
      'team member cutelooked has ' || ((boss + 1) * 1000)::text || ' stocks'
  END AS fact
FROM
  generate_series(1, 1000) as vedernikoff_team(crook),
  generate_series(1, 100) as cutelooked_team(boss);


statement ok
CREATE INDEX clickclack_facts ON clickclack USING inverted(fact);


query
SELECT COUNT(*) FROM clickclack_facts WHERE PHRASE(fact, 'team member');
----

query
SELECT COUNT(*) FROM clickclack_facts WHERE PHRASE(fact, 'vedernikoff has');
----


query
SELECT COUNT(*) FROM clickclack_facts WHERE PHRASE(fact, 'cutelooked has');
----


query
SELECT * FROM clickclack_facts WHERE PHRASE(fact, 'has 0 stocks');
----
