hash-threshold 100


statement ok
CREATE TABLE vedernikoff_crew (pid INTEGER PRIMARY KEY, nickname VARCHAR, stocks INTEGER);

statement ok
CREATE INDEX vedernikoff_crew_stocks_idx ON vedernikoff_crew USING secondary(stocks);

statement ok
INSERT INTO vedernikoff_crew VALUES (1, 'vedernikoff', 30);

statement ok
INSERT INTO vedernikoff_crew VALUES (2, 'cutelooked', 25);

statement ok
INSERT INTO vedernikoff_crew VALUES (3, 'crookface', 30);

statement ok
INSERT INTO vedernikoff_crew VALUES (4, 'bossmann', 35);

query
SELECT pid, nickname, stocks FROM vedernikoff_crew ORDER BY pid;
----
pid	nickname	stocks
1	vedernikoff	30
2	cutelooked	25
3	crookface	30
4	bossmann	35

query
SELECT pid, nickname, stocks FROM vedernikoff_crew WHERE stocks = 30 ORDER BY pid;
----
pid	nickname	stocks
1	vedernikoff	30
3	crookface	30

query
SELECT pid, nickname, stocks FROM vedernikoff_crew WHERE stocks = 25;
----
pid	nickname	stocks
2	cutelooked	25

query
SELECT pid, nickname, stocks FROM vedernikoff_crew WHERE stocks = 99;
----
pid	nickname	stocks

statement ok
UPDATE vedernikoff_crew SET stocks = 31 WHERE pid = 1;

query
SELECT pid, nickname, stocks FROM vedernikoff_crew WHERE stocks = 30;
----
pid	nickname	stocks
3	crookface	30

query
SELECT pid, nickname, stocks FROM vedernikoff_crew WHERE stocks = 31;
----
pid	nickname	stocks
1	vedernikoff	31

statement ok
DELETE FROM vedernikoff_crew WHERE pid = 3;

query
SELECT pid, nickname, stocks FROM vedernikoff_crew WHERE stocks = 30;
----
pid	nickname	stocks

query
SELECT pid, nickname, stocks FROM vedernikoff_crew ORDER BY pid;
----
pid	nickname	stocks
1	vedernikoff	31
2	cutelooked	25
4	bossmann	35

statement ok
INSERT INTO vedernikoff_crew VALUES (5, 'crookjunior', NULL);

statement ok
INSERT INTO vedernikoff_crew VALUES (6, 'stockpiler', NULL);

query
SELECT pid, nickname, stocks FROM vedernikoff_crew ORDER BY pid;
----
pid	nickname	stocks
1	vedernikoff	31
2	cutelooked	25
4	bossmann	35
5	crookjunior	NULL
6	stockpiler	NULL

query
SELECT pid, nickname FROM vedernikoff_crew WHERE stocks IS NULL ORDER BY pid;
----
pid	nickname
5	crookjunior
6	stockpiler

statement ok
DELETE FROM vedernikoff_crew WHERE pid = 5;

query
SELECT pid, nickname FROM vedernikoff_crew WHERE stocks IS NULL;
----
pid	nickname
6	stockpiler

statement ok
DROP TABLE vedernikoff_crew;


statement ok
CREATE TABLE babsky_vault (pid INTEGER PRIMARY KEY, loot INTEGER);

statement ok
INSERT INTO babsky_vault VALUES (1, 100), (2, 200), (3, 100), (4, 300), (5, 100);

statement ok
CREATE INDEX babsky_vault_loot_idx ON babsky_vault USING secondary(loot);

query
SELECT pid, loot FROM babsky_vault WHERE loot = 100 ORDER BY pid;
----
pid	loot
1	100
3	100
5	100

query
SELECT pid, loot FROM babsky_vault WHERE loot = 300;
----
pid	loot
4	300

statement ok
INSERT INTO babsky_vault VALUES (6, 100), (7, 200);

query
SELECT pid, loot FROM babsky_vault WHERE loot = 100 ORDER BY pid;
----
pid	loot
1	100
3	100
5	100
6	100

query
SELECT pid, loot FROM babsky_vault WHERE loot = 200 ORDER BY pid;
----
pid	loot
2	200
7	200

statement ok
UPDATE babsky_vault SET loot = 999 WHERE pid = 1;

query
SELECT pid, loot FROM babsky_vault WHERE loot = 100 ORDER BY pid;
----
pid	loot
3	100
5	100
6	100

query
SELECT pid, loot FROM babsky_vault WHERE loot = 999;
----
pid	loot
1	999

statement ok
DELETE FROM babsky_vault WHERE pid = 3;

query
SELECT pid, loot FROM babsky_vault WHERE loot = 100 ORDER BY pid;
----
pid	loot
5	100
6	100

statement ok
DROP TABLE babsky_vault;


statement ok
CREATE TABLE clickclack_ranks (pid INTEGER PRIMARY KEY, rank INTEGER);

statement ok
CREATE INDEX clickclack_ranks_idx ON clickclack_ranks USING secondary(rank);

statement ok
CREATE INDEX IF NOT EXISTS clickclack_ranks_idx ON clickclack_ranks USING secondary(rank);

statement error
CREATE INDEX clickclack_ranks_idx ON clickclack_ranks USING secondary(rank);

statement ok
DROP TABLE clickclack_ranks;


statement ok
CREATE TABLE babsky_division (pid INTEGER PRIMARY KEY, leader VARCHAR, team VARCHAR);

statement ok
CREATE INDEX babsky_division_leader_idx ON babsky_division USING secondary(leader);

statement ok
INSERT INTO babsky_division VALUES
  (1, 'vedernikoff', 'alpha'),
  (2, 'cutelooked', 'beta'),
  (3, 'crookface', 'alpha'),
  (4, 'vedernikoff', 'gamma'),
  (5, 'bossmann', 'delta'),
  (6, 'cutelooked', 'alpha'),
  (7, 'stockpiler', 'beta');

query
SELECT pid, leader, team FROM babsky_division WHERE leader = 'vedernikoff' ORDER BY pid;
----
pid	leader	team
1	vedernikoff	alpha
4	vedernikoff	gamma

query
SELECT pid, leader, team FROM babsky_division WHERE leader = 'cutelooked' ORDER BY pid;
----
pid	leader	team
2	cutelooked	beta
6	cutelooked	alpha

query
SELECT pid, leader, team FROM babsky_division WHERE leader = 'crookface';
----
pid	leader	team
3	crookface	alpha

query
SELECT pid, leader, team FROM babsky_division WHERE leader = 'nobody';
----
pid	leader	team

statement ok
UPDATE babsky_division SET leader = 'crookface' WHERE pid = 1;

query
SELECT pid, leader, team FROM babsky_division WHERE leader = 'vedernikoff';
----
pid	leader	team
4	vedernikoff	gamma

query
SELECT pid, leader, team FROM babsky_division WHERE leader = 'crookface' ORDER BY pid;
----
pid	leader	team
1	crookface	alpha
3	crookface	alpha

statement ok
DELETE FROM babsky_division WHERE pid = 3;

query
SELECT pid, leader, team FROM babsky_division WHERE leader = 'crookface';
----
pid	leader	team
1	crookface	alpha

statement ok
DROP TABLE babsky_division;


statement ok
CREATE TABLE clickclack_stash (pid INTEGER PRIMARY KEY, amount BIGINT, active BOOLEAN);

statement ok
CREATE INDEX clickclack_stash_amount_idx ON clickclack_stash USING secondary(amount);

statement ok
CREATE INDEX clickclack_stash_active_idx ON clickclack_stash USING secondary(active);

statement ok
INSERT INTO clickclack_stash VALUES
  (1, 1000000000000, true),
  (2, 2000000000000, false),
  (3, 1000000000000, true),
  (4, 3000000000000, false),
  (5, 1000000000000, false);

query
SELECT pid, amount FROM clickclack_stash WHERE amount = 1000000000000 ORDER BY pid;
----
pid	amount
1	1000000000000
3	1000000000000
5	1000000000000

query
SELECT pid, active FROM clickclack_stash WHERE active = true ORDER BY pid;
----
pid	active
1	t
3	t

query
SELECT pid, active FROM clickclack_stash WHERE active = false ORDER BY pid;
----
pid	active
2	f
4	f
5	f

statement ok
UPDATE clickclack_stash SET active = false WHERE pid = 1;

query
SELECT pid, active FROM clickclack_stash WHERE active = true;
----
pid	active
3	t

statement ok
DROP TABLE clickclack_stash;


statement ok
CREATE TABLE vedernikoff_empire (pid INTEGER PRIMARY KEY, balance INTEGER);

statement ok
CREATE INDEX vedernikoff_empire_balance_idx ON vedernikoff_empire USING secondary(balance);

statement ok
INSERT INTO vedernikoff_empire VALUES
  (1, -100), (2, 0), (3, 100), (4, -100), (5, 0), (6, 200);

query
SELECT pid, balance FROM vedernikoff_empire WHERE balance = -100 ORDER BY pid;
----
pid	balance
1	-100
4	-100

query
SELECT pid, balance FROM vedernikoff_empire WHERE balance = 0 ORDER BY pid;
----
pid	balance
2	0
5	0

query
SELECT pid, balance FROM vedernikoff_empire WHERE balance = 100;
----
pid	balance
3	100

statement ok
UPDATE vedernikoff_empire SET balance = 500 WHERE pid = 1;

query
SELECT pid, balance FROM vedernikoff_empire WHERE balance = -100;
----
pid	balance
4	-100

query
SELECT pid, balance FROM vedernikoff_empire WHERE balance = 500;
----
pid	balance
1	500

statement ok
DELETE FROM vedernikoff_empire WHERE balance = 0;

query
SELECT pid, balance FROM vedernikoff_empire WHERE balance = 0;
----
pid	balance

query
SELECT pid, balance FROM vedernikoff_empire ORDER BY pid;
----
pid	balance
1	500
3	100
4	-100
6	200

statement ok
DROP TABLE vedernikoff_empire;


statement ok
CREATE TABLE clickclack_heist (pid INTEGER PRIMARY KEY, target VARCHAR, loot INTEGER);

statement ok
CREATE INDEX clickclack_heist_loot_idx ON clickclack_heist USING secondary(loot);

statement ok
INSERT INTO clickclack_heist VALUES (1, 'bank', 1000), (2, 'museum', 2000);

query
EXPLAIN SELECT pid, target FROM clickclack_heist WHERE loot = 1000;
----
QUERY PLAN
EXECUTION PLAN:
Fragment 0:  numWorkers=0:
-- Project[1][expressions: (pid:INTEGER, "pid"), (target:VARCHAR, "target")] -> "pid":INTEGER, "target":VARCHAR
  -- TableScan[0][clickclack_heist, scan=secondary_index] -> "pid":INTEGER, "target":VARCHAR

statement ok
DROP TABLE clickclack_heist;


statement ok
CREATE TABLE babsky_mafia (pid INTEGER PRIMARY KEY, hitman VARCHAR, bounty INTEGER);

statement ok
CREATE INDEX babsky_mafia_bounty_idx ON babsky_mafia USING secondary(bounty);

statement ok
CREATE INDEX babsky_mafia_hitman_idx ON babsky_mafia USING secondary(hitman);

statement ok
INSERT INTO babsky_mafia VALUES
  (1, 'vedernikoff', 500),
  (2, 'cutelooked', 300),
  (3, 'crookface', 500),
  (4, 'stockpiler', 700),
  (5, 'vedernikoff', 300),
  (6, 'bossmann', 1000),
  (7, 'crookface', 300),
  (8, 'cutelooked', 500);

query
SELECT pid, hitman FROM babsky_mafia WHERE bounty = 500 ORDER BY pid;
----
pid	hitman
1	vedernikoff
3	crookface
8	cutelooked

query
SELECT pid, bounty FROM babsky_mafia WHERE hitman = 'vedernikoff' ORDER BY pid;
----
pid	bounty
1	500
5	300

query
SELECT pid, bounty FROM babsky_mafia WHERE hitman = 'crookface' ORDER BY pid;
----
pid	bounty
3	500
7	300

statement ok
UPDATE babsky_mafia SET bounty = 900 WHERE hitman = 'crookface';

query
SELECT pid, hitman FROM babsky_mafia WHERE bounty = 500 ORDER BY pid;
----
pid	hitman
1	vedernikoff
8	cutelooked

query
SELECT pid, hitman FROM babsky_mafia WHERE bounty = 900 ORDER BY pid;
----
pid	hitman
3	crookface
7	crookface

statement ok
DELETE FROM babsky_mafia WHERE hitman = 'cutelooked';

query
SELECT pid, bounty FROM babsky_mafia WHERE hitman = 'cutelooked';
----
pid	bounty

query
SELECT pid, hitman FROM babsky_mafia WHERE bounty = 300;
----
pid	hitman
5	vedernikoff

query
SELECT pid, hitman, bounty FROM babsky_mafia ORDER BY pid;
----
pid	hitman	bounty
1	vedernikoff	500
3	crookface	900
4	stockpiler	700
5	vedernikoff	300
6	bossmann	1000
7	crookface	900

statement ok
DROP TABLE babsky_mafia;


statement ok
CREATE TABLE vedernikoff_nullvault (pid INTEGER PRIMARY KEY, grade INTEGER, tag VARCHAR);

statement ok
CREATE INDEX vedernikoff_nullvault_grade_idx ON vedernikoff_nullvault USING secondary(grade);

statement ok
INSERT INTO vedernikoff_nullvault VALUES (1, 10, 'alpha'), (4, 20, 'delta'), (6, 10, 'zeta');

statement ok
INSERT INTO vedernikoff_nullvault VALUES (2, NULL, 'beta'), (3, NULL, 'gamma'), (5, NULL, 'epsilon');

query
SELECT pid, tag FROM vedernikoff_nullvault WHERE grade IS NULL ORDER BY pid;
----
pid	tag
2	beta
3	gamma
5	epsilon

query
SELECT pid, tag FROM vedernikoff_nullvault WHERE grade = 10 ORDER BY pid;
----
pid	tag
1	alpha
6	zeta

statement ok
UPDATE vedernikoff_nullvault SET grade = NULL WHERE pid = 1;

query
SELECT pid, tag FROM vedernikoff_nullvault WHERE grade IS NULL ORDER BY pid;
----
pid	tag
1	alpha
2	beta
3	gamma
5	epsilon

query
SELECT pid, tag FROM vedernikoff_nullvault WHERE grade = 10;
----
pid	tag
6	zeta

statement ok
UPDATE vedernikoff_nullvault SET grade = 30 WHERE pid = 2;

query
SELECT pid, tag FROM vedernikoff_nullvault WHERE grade IS NULL ORDER BY pid;
----
pid	tag
1	alpha
3	gamma
5	epsilon

query
SELECT pid, tag FROM vedernikoff_nullvault WHERE grade = 30;
----
pid	tag
2	beta

query
EXPLAIN SELECT pid, tag FROM vedernikoff_nullvault WHERE grade IS NULL;
----
QUERY PLAN
EXECUTION PLAN:
Fragment 0:  numWorkers=0:
-- Project[1][expressions: (pid:INTEGER, "pid"), (tag:VARCHAR, "tag")] -> "pid":INTEGER, "tag":VARCHAR
  -- TableScan[0][vedernikoff_nullvault, scan=secondary_index] -> "pid":INTEGER, "tag":VARCHAR

query
EXPLAIN SELECT pid, tag FROM vedernikoff_nullvault WHERE grade = 10;
----
QUERY PLAN
EXECUTION PLAN:
Fragment 0:  numWorkers=0:
-- Project[1][expressions: (pid:INTEGER, "pid"), (tag:VARCHAR, "tag")] -> "pid":INTEGER, "tag":VARCHAR
  -- TableScan[0][vedernikoff_nullvault, scan=secondary_index] -> "pid":INTEGER, "tag":VARCHAR

statement ok
DROP TABLE vedernikoff_nullvault;


statement ok
CREATE TABLE clickclack_ops (pid INTEGER PRIMARY KEY, op_type VARCHAR, reward INTEGER);

statement ok
CREATE INDEX clickclack_ops_type_idx ON clickclack_ops USING secondary(op_type);

statement ok
INSERT INTO clickclack_ops VALUES (1, 'heist', 500), (2, 'recon', 100), (4, 'heist', 300), (6, 'sabotage', 800);

statement ok
INSERT INTO clickclack_ops VALUES (3, NULL, 0), (5, NULL, 0);

query
SELECT pid, reward FROM clickclack_ops WHERE op_type = 'heist' ORDER BY pid;
----
pid	reward
1	500
4	300

query
SELECT pid, reward FROM clickclack_ops WHERE op_type IS NULL ORDER BY pid;
----
pid	reward
3	0
5	0

statement ok
DELETE FROM clickclack_ops WHERE pid = 3;

query
SELECT pid, reward FROM clickclack_ops WHERE op_type IS NULL;
----
pid	reward
5	0

statement ok
INSERT INTO clickclack_ops VALUES (7, NULL, 50);

query
SELECT pid, reward FROM clickclack_ops WHERE op_type IS NULL ORDER BY pid;
----
pid	reward
5	0
7	50

statement ok
UPDATE clickclack_ops SET op_type = 'heist' WHERE pid = 5;

query
SELECT pid, reward FROM clickclack_ops WHERE op_type IS NULL;
----
pid	reward
7	50

query
SELECT pid, reward FROM clickclack_ops WHERE op_type = 'heist' ORDER BY pid;
----
pid	reward
1	500
4	300
5	0

statement ok
DROP TABLE clickclack_ops;


statement ok
CREATE TABLE babsky_ledger (pid INTEGER PRIMARY KEY, region INTEGER, tier INTEGER, note VARCHAR);

statement ok
CREATE INDEX babsky_ledger_region_tier_idx ON babsky_ledger USING secondary(region, tier);

statement ok
INSERT INTO babsky_ledger VALUES
  (1, 1, 10, 'alpha'),
  (2, 1, 10, 'beta'),
  (3, 1, 20, 'gamma'),
  (4, 2, 10, 'delta'),
  (5, 2, 10, 'epsilon');

query
SELECT pid, note FROM babsky_ledger WHERE region = 1 AND tier = 10 ORDER BY pid;
----
pid	note
1	alpha
2	beta

query
SELECT pid, note FROM babsky_ledger WHERE region = 2 AND tier = 10 ORDER BY pid;
----
pid	note
4	delta
5	epsilon

statement ok
UPDATE babsky_ledger SET tier = 30 WHERE pid = 1;

query
SELECT pid, note FROM babsky_ledger WHERE region = 1 AND tier = 10;
----
pid	note
2	beta

query
SELECT pid, note FROM babsky_ledger WHERE region = 1 AND tier = 30;
----
pid	note
1	alpha

statement ok
DELETE FROM babsky_ledger WHERE pid = 4;

query
SELECT pid, note FROM babsky_ledger WHERE region = 2 AND tier = 10;
----
pid	note
5	epsilon

statement ok
INSERT INTO babsky_ledger VALUES (6, NULL, 10, 'zeta'), (7, NULL, 10, 'eta');

statement ok
INSERT INTO babsky_ledger VALUES (8, 1, NULL, 'theta');

query
SELECT pid, note FROM babsky_ledger WHERE region IS NULL ORDER BY pid;
----
pid	note
6	zeta
7	eta

query
SELECT pid, note FROM babsky_ledger WHERE tier IS NULL;
----
pid	note
8	theta

query
SELECT pid, region, tier, note FROM babsky_ledger ORDER BY pid;
----
pid	region	tier	note
1	1	30	alpha
2	1	10	beta
3	1	20	gamma
5	2	10	epsilon
6	NULL	10	zeta
7	NULL	10	eta
8	1	NULL	theta

statement ok
DROP TABLE babsky_ledger;


statement ok
CREATE TABLE vedernikoff_nullbulk (pid INTEGER PRIMARY KEY, val INTEGER);

statement ok
CREATE INDEX vedernikoff_nullbulk_val_idx ON vedernikoff_nullbulk USING secondary(val);

statement ok
INSERT INTO vedernikoff_nullbulk VALUES (1, NULL);

statement ok
INSERT INTO vedernikoff_nullbulk VALUES (2, NULL);

statement ok
INSERT INTO vedernikoff_nullbulk VALUES (3, NULL);

statement ok
INSERT INTO vedernikoff_nullbulk VALUES (4, NULL);

statement ok
INSERT INTO vedernikoff_nullbulk VALUES (5, NULL);

statement ok
INSERT INTO vedernikoff_nullbulk VALUES (6, NULL);

statement ok
INSERT INTO vedernikoff_nullbulk VALUES (7, NULL);

statement ok
INSERT INTO vedernikoff_nullbulk VALUES (8, NULL);

statement ok
INSERT INTO vedernikoff_nullbulk VALUES (9, NULL);

statement ok
INSERT INTO vedernikoff_nullbulk VALUES (10, NULL);

statement ok
INSERT INTO vedernikoff_nullbulk VALUES (11, 42), (12, 42), (13, 99);

query
SELECT count(*) FROM vedernikoff_nullbulk WHERE val IS NULL;
----
count
10

query
SELECT pid FROM vedernikoff_nullbulk WHERE val IS NULL ORDER BY pid;
----
pid
1
2
3
4
5
6
7
8
9
10

query
SELECT pid FROM vedernikoff_nullbulk WHERE val = 42 ORDER BY pid;
----
pid
11
12

statement ok
DELETE FROM vedernikoff_nullbulk WHERE pid IN (3, 5, 7);

query
SELECT count(*) FROM vedernikoff_nullbulk WHERE val IS NULL;
----
count
7

statement ok
UPDATE vedernikoff_nullbulk SET val = 1 WHERE pid = 1;

query
SELECT count(*) FROM vedernikoff_nullbulk WHERE val IS NULL;
----
count
6

statement ok
DROP TABLE vedernikoff_nullbulk;
