hash-threshold 100

# `SELECT col, count(*) FROM idx GROUP BY col` over a keyword NOT NULL column
# is a facet served from the term dictionary: the groups are exactly the
# field's live terms and each group's size is the term's live document count.
# The user's own GROUP BY merges the per-segment term rows (summing counts), so
# results stay exact under deletion masks. Nullable columns, extra aggregates,
# multiple group keys and cross-field WHERE clauses fall back to the document
# scan. Background maintenance is disabled; visibility is driven by
# VACUUM (REFRESH_TABLE).

statement ok
CREATE TEXT SEARCH DICTIONARY fct_kw(template = 'keyword')

statement ok
CREATE TABLE ft(id INTEGER PRIMARY KEY, cat VARCHAR NOT NULL, opt VARCHAR)

statement ok
CREATE INDEX ft_idx ON ft USING inverted(cat fct_kw, opt fct_kw)
    WITH (refresh_interval = 0, compaction_interval = 0)

statement ok
INSERT INTO ft VALUES
  (1, 'red',   'x'),
  (2, 'green', NULL),
  (3, 'red',   'y'),
  (4, 'blue',  'x'),
  (5, 'red',   'x'),
  (6, 'green', 'z')

statement ok
VACUUM (REFRESH_TABLE) ft;

query TI
SELECT cat, count(*) AS n FROM ft_idx GROUP BY cat ORDER BY cat
----
cat	n
blue	1
green	2
red	3

query TI
SELECT cat, count(*) AS n FROM ft GROUP BY cat ORDER BY cat
----
cat	n
blue	1
green	2
red	3

query TI
SELECT cat, count(cat) AS n FROM ft_idx GROUP BY cat ORDER BY cat
----
cat	n
blue	1
green	2
red	3

query T
SELECT cat FROM ft_idx GROUP BY cat ORDER BY cat
----
cat
blue
green
red

query TI
SELECT cat, count(*) AS n FROM ft_idx GROUP BY cat
ORDER BY n DESC, cat LIMIT 2
----
cat	n
red	3
green	2

query TI
SELECT cat, count(*) AS n FROM ft_idx GROUP BY cat
HAVING count(*) > 1 ORDER BY cat
----
cat	n
green	2
red	3

# Same-field WHERE composes: acceptor or post-filter over the terms.
query TI
SELECT cat, count(*) AS n FROM ft_idx WHERE cat LIKE 'r%'
GROUP BY cat ORDER BY cat
----
cat	n
red	3

query TI
SELECT cat, count(*) AS n FROM ft_idx WHERE cat = 'blue' OR length(cat) = 5
GROUP BY cat ORDER BY cat
----
cat	n
blue	1
green	2

query
EXPLAIN SELECT cat, count(*) AS n FROM ft_idx GROUP BY cat
----
QUERY PLAN
┌───────────────────────────┐
│         PROJECTION        │
│    ────────────────────   │
│  sdb_inverted_index_term$ │
│     CAST(#1 AS BIGINT)    │
│                           │
│          ~3 rows          │
└─────────────┬─────────────┘
┌─────────────┴─────────────┐
│       HASH_GROUP_BY       │
│    ────────────────────   │
│         Groups: #0        │
│    Aggregates: sum(#1)    │
│                           │
│          ~3 rows          │
└─────────────┬─────────────┘
┌─────────────┴─────────────┐
│         PROJECTION        │
│    ────────────────────   │
│  sdb_inverted_index_term$ │
│sdb_inverted_index_term_cou│
│            nt$            │
│                           │
│          ~6 rows          │
└─────────────┬─────────────┘
┌─────────────┴─────────────┐
│       IRESEARCH_SCAN      │
│    ────────────────────   │
│       Index: ft_idx       │
│        TsDict: cat        │
│                           │
│        Projections:       │
│  sdb_inverted_index_term$ │
│sdb_inverted_index_term_cou│
│            nt$            │
│                           │
│          ~6 rows          │
└───────────────────────────┘

# Fallbacks stay on the document scan and stay correct: nullable group column
# (the dictionary has no NULL term), an aggregate the dictionary cannot serve,
# two group keys, and a cross-field WHERE.
query TI
SELECT opt, count(*) AS n FROM ft_idx GROUP BY opt ORDER BY opt NULLS FIRST
----
opt	n
NULL	1
x	3
y	1
z	1

query TII
SELECT cat, count(*) AS n, sum(id) AS s FROM ft_idx GROUP BY cat ORDER BY cat
----
cat	n	s
blue	1	4
green	2	8
red	3	9

query TI
SELECT cat, count(*) AS n FROM ft_idx WHERE id < 3 GROUP BY cat ORDER BY cat
----
cat	n
green	1
red	1

# Deletions: 'blue' dies with row 4 and 'red' loses row 5; facet counts are
# live-exact on the still-dirty segment.
statement ok
DELETE FROM ft WHERE id IN (4, 5)

statement ok
VACUUM (REFRESH_TABLE) ft;

query TI
SELECT cat, count(*) AS n FROM ft_idx GROUP BY cat ORDER BY cat
----
cat	n
green	2
red	2

# A fresh clean segment sums with the dirty one per term.
statement ok
INSERT INTO ft VALUES (7, 'red', 'x'), (8, 'amber', NULL)

statement ok
VACUUM (REFRESH_TABLE) ft;

query TI
SELECT cat, count(*) AS n FROM ft_idx GROUP BY cat ORDER BY cat
----
cat	n
amber	1
green	2
red	3

query TI
SELECT cat, count(*) AS n FROM ft_idx GROUP BY cat
ORDER BY n DESC, cat LIMIT 2
----
cat	n
red	3
green	2

query TI
SELECT cat, count(*) AS n FROM ft GROUP BY cat ORDER BY cat
----
cat	n
amber	1
green	2
red	3
