hash-threshold 100

# ts_dict facet pushdown with a residual filter on a covered (INCLUDE'd)
# column. The GROUP BY key is an indexed keyword field; the WHERE mixes an
# indexed @@ document predicate (claimed into the index) with a predicate over
# a stored `.col` column that is NOT a term field. duckdb pushes the latter as
# a columnstore filter, and the term-dict scan applies it per document while
# counting -- so the facet still reads counts from the dictionary instead of a
# document scan. IN-lists / disjunctions decline to a doc scan (still correct).
# Each index query has an EXPLAIN pinning the plan, and each result is checked
# against the same query over the base table (the oracle). Both a table-backed
# and a view-backed index are covered. Background maintenance is off.

statement ok
SET compaction_interval = 0

statement ok
SET refresh_interval = 0

statement ok
CREATE TEXT SEARCH DICTIONARY rkw(template = 'keyword', frequency = true)

statement ok
CREATE TEXT SEARCH DICTIONARY rtx(template = 'text', locale = 'en_US.UTF-8',
    case = 'lower', stemming = false, accent = false, frequency = true,
    position = true)

statement ok
CREATE TABLE rbase(id INTEGER PRIMARY KEY, sev VARCHAR NOT NULL,
                   svc VARCHAR NOT NULL, region VARCHAR, tier VARCHAR,
                   body VARCHAR NOT NULL)

statement ok
INSERT INTO rbase VALUES
  (1, 'ERROR', 'frontend', 'us',  'gold',   'disk failed'),
  (2, 'INFO',  'frontend', 'us',  'gold',   'all ok'),
  (3, 'ERROR', 'backend',  'eu',  NULL,     'net failed'),
  (4, 'WARN',  'frontend', 'eu',  'silver', 'failed retry'),
  (5, 'INFO',  'backend',  'us',  NULL,     'failed once'),
  (6, 'ERROR', 'frontend', NULL,  NULL,     'failed hard'),
  (7, 'WARN',  'backend',  'us',  'silver', 'disk failed slow'),
  (8, 'ERROR', 'frontend', 'us',  'gold',   'failed again')

statement ok
CREATE INDEX rtab_idx ON rbase USING inverted(sev rkw, tier rkw, body rtx)
    INCLUDE (svc, region) WITH (refresh_interval = 0, compaction_interval = 0)

statement ok
CREATE VIEW rlog AS
SELECT id, sev AS Sev, svc AS Svc, region AS Region, tier AS Tier, body AS Body
FROM rbase

statement ok
CREATE INDEX rlog_idx ON rlog USING inverted(Sev rkw, Tier rkw, Body rtx)
    INCLUDE (Svc, Region) WITH (refresh_interval = 0, compaction_interval = 0)

statement ok
VACUUM (REFRESH_TABLE) rbase;

# ==========================================================================
# Table-backed index
# ==========================================================================

# --- equality residual on a covered column
query
EXPLAIN SELECT sev, count(*) FROM rtab_idx WHERE svc = 'frontend' GROUP BY sev
----
QUERY PLAN
╭─ PROJECTION ──────────────────────────────╮
│ Projections: sdb_inverted_index_term$sev, │
│              CAST(#1 AS BIGINT)           │
│ ~0 rows                                   │
╰─────────────────────┬─────────────────────╯
╭─ HASH_GROUP_BY ─────┴─────────────────────╮
│ Groups: #0                                │
│ Aggregates: sum(#1)                       │
│ ~0 rows                                   │
╰─────────────────────┬─────────────────────╯
╭─ IRESEARCH_SCAN ────┴─────────────────────╮
│ Index: rtab_idx                           │
│ TsDict: sev                               │
│ Projections:                              │
│ sdb_inverted_index_term$sev,              │
│ sdb_inverted_index_term_count$sev         │
│ Column Filter: svc = 'frontend'           │
│ ~1 row                                    │
╰───────────────────────────────────────────╯

query TI
SELECT sev, count(*) AS n FROM rtab_idx
WHERE svc = 'frontend' GROUP BY sev ORDER BY n DESC, sev
----
sev	n
ERROR	3
INFO	1
WARN	1

query TI
SELECT sev, count(*) AS n FROM rbase
WHERE svc = 'frontend' GROUP BY sev ORDER BY n DESC, sev
----
sev	n
ERROR	3
INFO	1
WARN	1

# --- equality residual + indexed @@ predicate
query
EXPLAIN SELECT sev, count(*) FROM rtab_idx WHERE svc = 'frontend' AND body @@ 'failed' GROUP BY sev
----
QUERY PLAN
╭─ PROJECTION ──────────────────────────────╮
│ Projections: sdb_inverted_index_term$sev, │
│              CAST(#1 AS BIGINT)           │
│ ~0 rows                                   │
╰─────────────────────┬─────────────────────╯
╭─ HASH_GROUP_BY ─────┴─────────────────────╮
│ Groups: #0                                │
│ Aggregates: sum(#1)                       │
│ ~0 rows                                   │
╰─────────────────────┬─────────────────────╯
╭─ IRESEARCH_SCAN ────┴─────────────────────╮
│ Index: rtab_idx                           │
│ Index Filter:                             │
│ ╭─ Term ──────────────╮                   │
│ │ Field: body(string) │                   │
│ │ Value: failed       │                   │
│ ╰─────────────────────╯                   │
│ Column Filter: svc = 'frontend'           │
│ TsDict: sev                               │
│ Projections:                              │
│ sdb_inverted_index_term$sev,              │
│ sdb_inverted_index_term_count$sev         │
│ ~1 row                                    │
╰───────────────────────────────────────────╯

query TI
SELECT sev, count(*) AS n FROM rtab_idx
WHERE svc = 'frontend' AND body @@ 'failed' GROUP BY sev ORDER BY n DESC, sev
----
sev	n
ERROR	3
WARN	1

query TI
SELECT sev, count(*) AS n FROM rbase
WHERE svc = 'frontend' AND body LIKE '%failed%' GROUP BY sev ORDER BY n DESC, sev
----
sev	n
ERROR	3
WARN	1

# --- equality residual on a nullable covered column
query
EXPLAIN SELECT sev, count(*) FROM rtab_idx WHERE region = 'us' GROUP BY sev
----
QUERY PLAN
╭─ PROJECTION ──────────────────────────────╮
│ Projections: sdb_inverted_index_term$sev, │
│              CAST(#1 AS BIGINT)           │
│ ~0 rows                                   │
╰─────────────────────┬─────────────────────╯
╭─ HASH_GROUP_BY ─────┴─────────────────────╮
│ Groups: #0                                │
│ Aggregates: sum(#1)                       │
│ ~0 rows                                   │
╰─────────────────────┬─────────────────────╯
╭─ IRESEARCH_SCAN ────┴─────────────────────╮
│ Index: rtab_idx                           │
│ TsDict: sev                               │
│ Projections:                              │
│ sdb_inverted_index_term$sev,              │
│ sdb_inverted_index_term_count$sev         │
│ Column Filter: region = 'us'              │
│ ~1 row                                    │
╰───────────────────────────────────────────╯

query TI
SELECT sev, count(*) AS n FROM rtab_idx
WHERE region = 'us' GROUP BY sev ORDER BY n DESC, sev
----
sev	n
ERROR	2
INFO	2
WARN	1

query TI
SELECT sev, count(*) AS n FROM rbase
WHERE region = 'us' GROUP BY sev ORDER BY n DESC, sev
----
sev	n
ERROR	2
INFO	2
WARN	1

# --- expression residual over a covered column (single transform)
query
EXPLAIN SELECT sev, count(*) FROM rtab_idx WHERE lower(svc) = 'backend' GROUP BY sev
----
QUERY PLAN
╭─ PROJECTION ──────────────────────────────╮
│ Projections: sdb_inverted_index_term$sev, │
│              CAST(#1 AS BIGINT)           │
│ ~0 rows                                   │
╰─────────────────────┬─────────────────────╯
╭─ HASH_GROUP_BY ─────┴─────────────────────╮
│ Groups: #0                                │
│ Aggregates: sum(#1)                       │
│ ~0 rows                                   │
╰─────────────────────┬─────────────────────╯
╭─ IRESEARCH_SCAN ────┴─────────────────────╮
│ Index: rtab_idx                           │
│ TsDict: sev                               │
│ Projections:                              │
│ sdb_inverted_index_term$sev,              │
│ sdb_inverted_index_term_count$sev         │
│ Column Filter: lower(svc) = 'backend'     │
│ ~1 row                                    │
╰───────────────────────────────────────────╯

query TI
SELECT sev, count(*) AS n FROM rtab_idx
WHERE lower(svc) = 'backend' GROUP BY sev ORDER BY n DESC, sev
----
sev	n
ERROR	1
INFO	1
WARN	1

query TI
SELECT sev, count(*) AS n FROM rbase
WHERE lower(svc) = 'backend' GROUP BY sev ORDER BY n DESC, sev
----
sev	n
ERROR	1
INFO	1
WARN	1

# --- IS NULL residual over a covered column
query
EXPLAIN SELECT sev, count(*) FROM rtab_idx WHERE region IS NULL GROUP BY sev
----
QUERY PLAN
╭─ PROJECTION ──────────────────────────────╮
│ Projections: sdb_inverted_index_term$sev, │
│              CAST(#1 AS BIGINT)           │
│ ~0 rows                                   │
╰─────────────────────┬─────────────────────╯
╭─ HASH_GROUP_BY ─────┴─────────────────────╮
│ Groups: #0                                │
│ Aggregates: sum(#1)                       │
│ ~0 rows                                   │
╰─────────────────────┬─────────────────────╯
╭─ IRESEARCH_SCAN ────┴─────────────────────╮
│ Index: rtab_idx                           │
│ TsDict: sev                               │
│ Projections:                              │
│ sdb_inverted_index_term$sev,              │
│ sdb_inverted_index_term_count$sev         │
│ Column Filter: region IS NULL             │
│ ~1 row                                    │
╰───────────────────────────────────────────╯

query TI
SELECT sev, count(*) AS n FROM rtab_idx
WHERE region IS NULL GROUP BY sev ORDER BY n DESC, sev
----
sev	n
ERROR	1

query TI
SELECT sev, count(*) AS n FROM rbase
WHERE region IS NULL GROUP BY sev ORDER BY n DESC, sev
----
sev	n
ERROR	1

# --- IS NOT NULL residual over a covered column
query
EXPLAIN SELECT sev, count(*) FROM rtab_idx WHERE region IS NOT NULL GROUP BY sev
----
QUERY PLAN
╭─ PROJECTION ──────────────────────────────╮
│ Projections: sdb_inverted_index_term$sev, │
│              CAST(#1 AS BIGINT)           │
│ ~0 rows                                   │
╰─────────────────────┬─────────────────────╯
╭─ HASH_GROUP_BY ─────┴─────────────────────╮
│ Groups: #0                                │
│ Aggregates: sum(#1)                       │
│ ~0 rows                                   │
╰─────────────────────┬─────────────────────╯
╭─ IRESEARCH_SCAN ────┴─────────────────────╮
│ Index: rtab_idx                           │
│ TsDict: sev                               │
│ Projections:                              │
│ sdb_inverted_index_term$sev,              │
│ sdb_inverted_index_term_count$sev         │
│ Column Filter: region IS NOT NULL         │
│ ~1 row                                    │
╰───────────────────────────────────────────╯

query TI
SELECT sev, count(*) AS n FROM rtab_idx
WHERE region IS NOT NULL GROUP BY sev ORDER BY n DESC, sev
----
sev	n
ERROR	3
INFO	2
WARN	2

query TI
SELECT sev, count(*) AS n FROM rbase
WHERE region IS NOT NULL GROUP BY sev ORDER BY n DESC, sev
----
sev	n
ERROR	3
INFO	2
WARN	2

# --- two plain-comparison residuals on different columns
query
EXPLAIN SELECT sev, count(*) FROM rtab_idx WHERE svc = 'frontend' AND region = 'us' GROUP BY sev
----
QUERY PLAN
╭─ PROJECTION ──────────────────────────────╮
│ Projections: sdb_inverted_index_term$sev, │
│              CAST(#1 AS BIGINT)           │
│ ~0 rows                                   │
╰─────────────────────┬─────────────────────╯
╭─ HASH_GROUP_BY ─────┴─────────────────────╮
│ Groups: #0                                │
│ Aggregates: sum(#1)                       │
│ ~0 rows                                   │
╰─────────────────────┬─────────────────────╯
╭─ IRESEARCH_SCAN ────┴─────────────────────╮
│ Index: rtab_idx                           │
│ TsDict: sev                               │
│ Projections:                              │
│ sdb_inverted_index_term$sev,              │
│ sdb_inverted_index_term_count$sev         │
│ Column Filter: svc = 'frontend',          │
│                region = 'us'              │
│ ~1 row                                    │
╰───────────────────────────────────────────╯

query TI
SELECT sev, count(*) AS n FROM rtab_idx
WHERE svc = 'frontend' AND region = 'us' GROUP BY sev ORDER BY n DESC, sev
----
sev	n
ERROR	2
INFO	1

query TI
SELECT sev, count(*) AS n FROM rbase
WHERE svc = 'frontend' AND region = 'us' GROUP BY sev ORDER BY n DESC, sev
----
sev	n
ERROR	2
INFO	1

# --- nullable facet key (tier) with a residual
query
EXPLAIN SELECT tier, count(*) FROM rtab_idx WHERE svc = 'frontend' GROUP BY tier
----
QUERY PLAN
╭─ PROJECTION ────────────────────────╮
│ Projections:                        │
│ sdb_inverted_index_term$tier,       │
│ CAST(#1 AS BIGINT)                  │
│ ~0 rows                             │
╰──────────────────┬──────────────────╯
╭─ HASH_GROUP_BY ──┴──────────────────╮
│ Groups: #0                          │
│ Aggregates: sum(#1)                 │
│ ~0 rows                             │
╰──────────────────┬──────────────────╯
╭─ IRESEARCH_SCAN ─┴──────────────────╮
│ Index: rtab_idx                     │
│ TsDict: tier                        │
│ Projections:                        │
│ sdb_inverted_index_term$tier,       │
│ sdb_inverted_index_term_count$tier  │
│ Column Filter: svc = 'frontend'     │
│ ~1 row                              │
╰─────────────────────────────────────╯

query TI
SELECT tier, count(*) AS n FROM rtab_idx
WHERE svc = 'frontend' GROUP BY tier ORDER BY n DESC, tier
----
tier	n
gold	3
silver	1
NULL	1

query TI
SELECT tier, count(*) AS n FROM rbase
WHERE svc = 'frontend' GROUP BY tier ORDER BY n DESC, tier
----
tier	n
gold	3
silver	1
NULL	1

# --- GROUPING SETS with a residual
query
EXPLAIN SELECT sev, count(*) FROM rtab_idx WHERE svc = 'frontend' GROUP BY GROUPING SETS ((sev))
----
QUERY PLAN
╭─ PROJECTION ──────────────────────────────╮
│ Projections: sdb_inverted_index_term$sev, │
│              CAST(#1 AS BIGINT)           │
│ ~0 rows                                   │
╰─────────────────────┬─────────────────────╯
╭─ HASH_GROUP_BY ─────┴─────────────────────╮
│ Groups: #0                                │
│ Aggregates: sum(#1)                       │
│ ~0 rows                                   │
╰─────────────────────┬─────────────────────╯
╭─ IRESEARCH_SCAN ────┴─────────────────────╮
│ Index: rtab_idx                           │
│ TsDict: sev                               │
│ Projections:                              │
│ sdb_inverted_index_term$sev,              │
│ sdb_inverted_index_term_count$sev         │
│ Column Filter: svc = 'frontend'           │
│ ~1 row                                    │
╰───────────────────────────────────────────╯

query TI
SELECT sev, count(*) AS n FROM rtab_idx
WHERE svc = 'frontend' GROUP BY GROUPING SETS ((sev)) ORDER BY n DESC, sev
----
sev	n
ERROR	3
INFO	1
WARN	1

query TI
SELECT sev, count(*) AS n FROM rbase
WHERE svc = 'frontend' GROUP BY GROUPING SETS ((sev)) ORDER BY n DESC, sev
----
sev	n
ERROR	3
INFO	1
WARN	1

# --- IN-list over a covered column -> document scan
query
EXPLAIN SELECT sev, count(*) FROM rtab_idx WHERE svc IN ('frontend', 'backend') GROUP BY sev
----
QUERY PLAN
╭─ HASH_GROUP_BY ────────────────────────────╮
│ Groups: #0                                 │
│ Aggregates: count_star()                   │
│ ~0 rows                                    │
╰──────────────────────┬─────────────────────╯
╭─ PROJECTION ─────────┴─────────────────────╮
│ Projections: #1                            │
│ ~1 row                                     │
╰──────────────────────┬─────────────────────╯
╭─ FILTER ─────────────┴─────────────────────╮
│ Expression:                                │
│ (svc = 'frontend') OR (svc = 'backend')    │
│ ~1 row                                     │
╰──────────────────────┬─────────────────────╯
╭─ IRESEARCH_SCAN ─────┴─────────────────────╮
│ Index: rtab_idx                            │
│ Lookup: table                              │
│ Projections: svc (i), sev (l)              │
│ Column Filter:                             │
│ optional: (svc IN ('frontend', 'backend')) │
│ ~8 rows                                    │
╰────────────────────────────────────────────╯

query TI
SELECT sev, count(*) AS n FROM rtab_idx
WHERE svc IN ('frontend', 'backend') GROUP BY sev ORDER BY n DESC, sev
----
sev	n
ERROR	4
INFO	2
WARN	2

query TI
SELECT sev, count(*) AS n FROM rbase
WHERE svc IN ('frontend', 'backend') GROUP BY sev ORDER BY n DESC, sev
----
sev	n
ERROR	4
INFO	2
WARN	2

# ==========================================================================
# View-backed index (behaves identically)
# ==========================================================================

# --- equality residual on a covered column of the view
query
EXPLAIN SELECT Sev, count(*) FROM rlog_idx WHERE Svc = 'frontend' GROUP BY Sev
----
QUERY PLAN
╭─ PROJECTION ──────────────────────────────╮
│ Projections: sdb_inverted_index_term$sev, │
│              CAST(#1 AS BIGINT)           │
│ ~0 rows                                   │
╰─────────────────────┬─────────────────────╯
╭─ HASH_GROUP_BY ─────┴─────────────────────╮
│ Groups: #0                                │
│ Aggregates: sum(#1)                       │
│ ~0 rows                                   │
╰─────────────────────┬─────────────────────╯
╭─ IRESEARCH_SCAN ────┴─────────────────────╮
│ Index: rlog_idx                           │
│ TsDict: sev                               │
│ Projections:                              │
│ sdb_inverted_index_term$sev,              │
│ sdb_inverted_index_term_count$sev         │
│ Column Filter: svc = 'frontend'           │
│ ~1 row                                    │
╰───────────────────────────────────────────╯

query TI
SELECT Sev, count(*) AS n FROM rlog_idx
WHERE Svc = 'frontend' GROUP BY Sev ORDER BY n DESC, Sev
----
sev	n
ERROR	3
INFO	1
WARN	1

query TI
SELECT sev, count(*) AS n FROM rbase
WHERE svc = 'frontend' GROUP BY sev ORDER BY n DESC, sev
----
sev	n
ERROR	3
INFO	1
WARN	1

# --- residual + indexed @@ predicate on the view
query
EXPLAIN SELECT Sev, count(*) FROM rlog_idx WHERE Svc = 'backend' AND Body @@ 'failed' GROUP BY Sev
----
QUERY PLAN
╭─ PROJECTION ──────────────────────────────╮
│ Projections: sdb_inverted_index_term$sev, │
│              CAST(#1 AS BIGINT)           │
│ ~0 rows                                   │
╰─────────────────────┬─────────────────────╯
╭─ HASH_GROUP_BY ─────┴─────────────────────╮
│ Groups: #0                                │
│ Aggregates: sum(#1)                       │
│ ~0 rows                                   │
╰─────────────────────┬─────────────────────╯
╭─ IRESEARCH_SCAN ────┴─────────────────────╮
│ Index: rlog_idx                           │
│ Index Filter:                             │
│ ╭─ Term ──────────────╮                   │
│ │ Field: body(string) │                   │
│ │ Value: failed       │                   │
│ ╰─────────────────────╯                   │
│ Column Filter: svc = 'backend'            │
│ TsDict: sev                               │
│ Projections:                              │
│ sdb_inverted_index_term$sev,              │
│ sdb_inverted_index_term_count$sev         │
│ ~1 row                                    │
╰───────────────────────────────────────────╯

query TI
SELECT Sev, count(*) AS n FROM rlog_idx
WHERE Svc = 'backend' AND Body @@ 'failed' GROUP BY Sev ORDER BY n DESC, Sev
----
sev	n
ERROR	1
INFO	1
WARN	1

query TI
SELECT sev, count(*) AS n FROM rbase
WHERE svc = 'backend' AND body LIKE '%failed%' GROUP BY sev ORDER BY n DESC, sev
----
sev	n
ERROR	1
INFO	1
WARN	1

# --- expression residual on the view
query
EXPLAIN SELECT Sev, count(*) FROM rlog_idx WHERE lower(Svc) = 'frontend' GROUP BY Sev
----
QUERY PLAN
╭─ PROJECTION ──────────────────────────────╮
│ Projections: sdb_inverted_index_term$sev, │
│              CAST(#1 AS BIGINT)           │
│ ~0 rows                                   │
╰─────────────────────┬─────────────────────╯
╭─ HASH_GROUP_BY ─────┴─────────────────────╮
│ Groups: #0                                │
│ Aggregates: sum(#1)                       │
│ ~0 rows                                   │
╰─────────────────────┬─────────────────────╯
╭─ IRESEARCH_SCAN ────┴─────────────────────╮
│ Index: rlog_idx                           │
│ TsDict: sev                               │
│ Projections:                              │
│ sdb_inverted_index_term$sev,              │
│ sdb_inverted_index_term_count$sev         │
│ Column Filter: lower(svc) = 'frontend'    │
│ ~1 row                                    │
╰───────────────────────────────────────────╯

query TI
SELECT Sev, count(*) AS n FROM rlog_idx
WHERE lower(Svc) = 'frontend' GROUP BY Sev ORDER BY n DESC, Sev
----
sev	n
ERROR	3
INFO	1
WARN	1

query TI
SELECT sev, count(*) AS n FROM rbase
WHERE lower(svc) = 'frontend' GROUP BY sev ORDER BY n DESC, sev
----
sev	n
ERROR	3
INFO	1
WARN	1

# --- nullable facet key + residual on the view
query
EXPLAIN SELECT Tier, count(*) FROM rlog_idx WHERE Svc = 'frontend' GROUP BY Tier
----
QUERY PLAN
╭─ PROJECTION ────────────────────────╮
│ Projections:                        │
│ sdb_inverted_index_term$tier,       │
│ CAST(#1 AS BIGINT)                  │
│ ~0 rows                             │
╰──────────────────┬──────────────────╯
╭─ HASH_GROUP_BY ──┴──────────────────╮
│ Groups: #0                          │
│ Aggregates: sum(#1)                 │
│ ~0 rows                             │
╰──────────────────┬──────────────────╯
╭─ IRESEARCH_SCAN ─┴──────────────────╮
│ Index: rlog_idx                     │
│ TsDict: tier                        │
│ Projections:                        │
│ sdb_inverted_index_term$tier,       │
│ sdb_inverted_index_term_count$tier  │
│ Column Filter: svc = 'frontend'     │
│ ~1 row                              │
╰─────────────────────────────────────╯

query TI
SELECT Tier, count(*) AS n FROM rlog_idx
WHERE Svc = 'frontend' GROUP BY Tier ORDER BY n DESC, Tier
----
tier	n
gold	3
silver	1
NULL	1

query TI
SELECT tier, count(*) AS n FROM rbase
WHERE svc = 'frontend' GROUP BY tier ORDER BY n DESC, tier
----
tier	n
gold	3
silver	1
NULL	1

# --- IS NULL residual over a nullable covered column of the view
query
EXPLAIN SELECT Sev, count(*) FROM rlog_idx WHERE Region IS NULL GROUP BY Sev
----
QUERY PLAN
╭─ PROJECTION ──────────────────────────────╮
│ Projections: sdb_inverted_index_term$sev, │
│              CAST(#1 AS BIGINT)           │
│ ~0 rows                                   │
╰─────────────────────┬─────────────────────╯
╭─ HASH_GROUP_BY ─────┴─────────────────────╮
│ Groups: #0                                │
│ Aggregates: sum(#1)                       │
│ ~0 rows                                   │
╰─────────────────────┬─────────────────────╯
╭─ IRESEARCH_SCAN ────┴─────────────────────╮
│ Index: rlog_idx                           │
│ TsDict: sev                               │
│ Projections:                              │
│ sdb_inverted_index_term$sev,              │
│ sdb_inverted_index_term_count$sev         │
│ Column Filter: region IS NULL             │
│ ~1 row                                    │
╰───────────────────────────────────────────╯

query TI
SELECT Sev, count(*) AS n FROM rlog_idx
WHERE Region IS NULL GROUP BY Sev ORDER BY n DESC, Sev
----
sev	n
ERROR	1

query TI
SELECT sev, count(*) AS n FROM rbase
WHERE region IS NULL GROUP BY sev ORDER BY n DESC, sev
----
sev	n
ERROR	1

# ==========================================================================
# Removals: the Column Filter composes with the live-doc mask and index filter
# ==========================================================================

# Table-backed only -- a view-backed index is a static snapshot. Deleting
# id 1 (ERROR/frontend) and id 6 (ERROR/frontend, NULL tier).

statement ok
DELETE FROM rbase WHERE id IN (1, 6)

statement ok
VACUUM (REFRESH_TABLE) rbase;

# --- covered residual + deletions (Masked mode + Column Filter)
query
EXPLAIN SELECT sev, count(*) FROM rtab_idx WHERE svc = 'frontend' GROUP BY sev
----
QUERY PLAN
╭─ PROJECTION ──────────────────────────────╮
│ Projections: sdb_inverted_index_term$sev, │
│              CAST(#1 AS BIGINT)           │
│ ~0 rows                                   │
╰─────────────────────┬─────────────────────╯
╭─ HASH_GROUP_BY ─────┴─────────────────────╮
│ Groups: #0                                │
│ Aggregates: sum(#1)                       │
│ ~0 rows                                   │
╰─────────────────────┬─────────────────────╯
╭─ IRESEARCH_SCAN ────┴─────────────────────╮
│ Index: rtab_idx                           │
│ TsDict: sev                               │
│ Projections:                              │
│ sdb_inverted_index_term$sev,              │
│ sdb_inverted_index_term_count$sev         │
│ Column Filter: svc = 'frontend'           │
│ ~1 row                                    │
╰───────────────────────────────────────────╯

query TI
SELECT sev, count(*) AS n FROM rtab_idx
WHERE svc = 'frontend' GROUP BY sev ORDER BY n DESC, sev
----
sev	n
ERROR	1
INFO	1
WARN	1

query TI
SELECT sev, count(*) AS n FROM rbase
WHERE svc = 'frontend' GROUP BY sev ORDER BY n DESC, sev
----
sev	n
ERROR	1
INFO	1
WARN	1

# --- index filter + covered residual + deletions (Where mode)
query
EXPLAIN SELECT sev, count(*) FROM rtab_idx WHERE svc = 'frontend' AND body @@ 'failed' GROUP BY sev
----
QUERY PLAN
╭─ PROJECTION ──────────────────────────────╮
│ Projections: sdb_inverted_index_term$sev, │
│              CAST(#1 AS BIGINT)           │
│ ~0 rows                                   │
╰─────────────────────┬─────────────────────╯
╭─ HASH_GROUP_BY ─────┴─────────────────────╮
│ Groups: #0                                │
│ Aggregates: sum(#1)                       │
│ ~0 rows                                   │
╰─────────────────────┬─────────────────────╯
╭─ IRESEARCH_SCAN ────┴─────────────────────╮
│ Index: rtab_idx                           │
│ Index Filter:                             │
│ ╭─ Term ──────────────╮                   │
│ │ Field: body(string) │                   │
│ │ Value: failed       │                   │
│ ╰─────────────────────╯                   │
│ Column Filter: svc = 'frontend'           │
│ TsDict: sev                               │
│ Projections:                              │
│ sdb_inverted_index_term$sev,              │
│ sdb_inverted_index_term_count$sev         │
│ ~1 row                                    │
╰───────────────────────────────────────────╯

query TI
SELECT sev, count(*) AS n FROM rtab_idx
WHERE svc = 'frontend' AND body @@ 'failed' GROUP BY sev ORDER BY n DESC, sev
----
sev	n
ERROR	1
WARN	1

query TI
SELECT sev, count(*) AS n FROM rbase
WHERE svc = 'frontend' AND body LIKE '%failed%' GROUP BY sev ORDER BY n DESC, sev
----
sev	n
ERROR	1
WARN	1

# --- nullable facet key + residual + deletions
query
EXPLAIN SELECT tier, count(*) FROM rtab_idx WHERE svc = 'frontend' GROUP BY tier
----
QUERY PLAN
╭─ PROJECTION ────────────────────────╮
│ Projections:                        │
│ sdb_inverted_index_term$tier,       │
│ CAST(#1 AS BIGINT)                  │
│ ~0 rows                             │
╰──────────────────┬──────────────────╯
╭─ HASH_GROUP_BY ──┴──────────────────╮
│ Groups: #0                          │
│ Aggregates: sum(#1)                 │
│ ~0 rows                             │
╰──────────────────┬──────────────────╯
╭─ IRESEARCH_SCAN ─┴──────────────────╮
│ Index: rtab_idx                     │
│ TsDict: tier                        │
│ Projections:                        │
│ sdb_inverted_index_term$tier,       │
│ sdb_inverted_index_term_count$tier  │
│ Column Filter: svc = 'frontend'     │
│ ~1 row                              │
╰─────────────────────────────────────╯

query TI
SELECT tier, count(*) AS n FROM rtab_idx
WHERE svc = 'frontend' GROUP BY tier ORDER BY n DESC, tier
----
tier	n
gold	2
silver	1

query TI
SELECT tier, count(*) AS n FROM rbase
WHERE svc = 'frontend' GROUP BY tier ORDER BY n DESC, tier
----
tier	n
gold	2
silver	1
