# DOCS_TEST: example_001

statement ok
CREATE TABLE people (id INTEGER, name VARCHAR, salary FLOAT);

statement ok
INSERT INTO people VALUES (1, 'John', 92_000.0), (2, 'Anna', 100_000.0);

# DOCS_TEST: example_002

statement error
MERGE INTO people
    USING (
        SELECT
            unnest([3, 1]) AS id,
            unnest(['Sarah', 'John']) AS name,
            unnest([95_000.0, 105_000.0]) AS salary
    ) AS upserts
    ON (upserts.id = people.id)
    WHEN MATCHED THEN UPDATE
    WHEN NOT MATCHED THEN INSERT;
----
db error: ERROR: Unsupported MERGE INTO action type for SereneDB


query
FROM people
ORDER BY id;
----
id	name	salary
2	Anna	100000
1	John	92000

# DOCS_TEST: example_003

statement error
MERGE INTO people
    USING (
        SELECT
            1 AS id,
            98_000.0 AS salary
    ) AS salary_updates
    USING (id)
    WHEN MATCHED THEN UPDATE SET salary = salary_updates.salary;
----
db error: ERROR: Unsupported MERGE INTO action type for SereneDB


query
FROM people
ORDER BY id;
----
id	name	salary
2	Anna	100000
1	John	92000

# DOCS_TEST: example_004

statement error
MERGE INTO people
    USING (
        SELECT
            1 AS id,
    ) AS deletes
    USING (id)
    WHEN MATCHED THEN DELETE;
----
db error: ERROR: Unsupported MERGE INTO action type for SereneDB


query
FROM people
ORDER BY id;
----
id	name	salary
2	Anna	100000
1	John	92000

# DOCS_TEST: example_005

statement error
MERGE INTO people
    USING (
        SELECT
            unnest([3, 2]) AS id,
    ) AS deletes
    USING (id)
    WHEN MATCHED AND people.salary >= 100_000.0 THEN DELETE;
----
db error: ERROR: Unsupported MERGE INTO action type for SereneDB


query
FROM people
ORDER BY id;
----
id	name	salary
2	Anna	100000
1	John	92000

# DOCS_TEST: example_006

statement ok
-- Let's get John back in!
INSERT INTO people VALUES (1, 'John', 105_000.0);

statement error
MERGE INTO people
    USING (
        SELECT
            unnest([3, 1]) AS id,
            unnest([89_000.0, 70_000.0]) AS salary
    ) AS upserts
    USING (id)
    WHEN MATCHED AND people.salary < 100_000.0 THEN UPDATE SET salary = upserts.salary
    -- Second update or delete condition
    WHEN MATCHED AND people.salary > 100_000.0 THEN DELETE
    WHEN NOT MATCHED THEN INSERT BY NAME
    RETURNING merge_action, *;
----
db error: ERROR: Unsupported MERGE INTO action type for SereneDB


# DOCS_TEST: example_007

statement ok
CREATE TABLE target AS
    SELECT unnest([1,2]) AS id;

statement error
MERGE INTO target
    USING (SELECT 1 AS id) source
    USING (id)
    WHEN MATCHED THEN UPDATE
    WHEN NOT MATCHED BY SOURCE THEN DELETE
    RETURNING merge_action, *;
----
db error: ERROR: Unsupported MERGE INTO action type for SereneDB

