# The remainder of the type/lifecycle matrix: UUID and ENUM (both bitpacking-backed), STRUCT and
# MAP child columns (each field/key/value is its own column tree with its own segments and block
# boundaries), and vacuum-driven row-group merges (a mass DELETE followed by CHECKPOINT rewrites
# the survivors through the full compression path -- the third distinct write path after fresh
# CTAS and WAL replay).
#
# The vacuum table uses DEFAULT row groups so 600k rows span 5 of them; deleting 91% of the rows
# non-uniformly (every non-tenth row, plus one full 100k band) forces the merge, pinned as
# 5 row groups -> 1. Everything else runs at ROW_GROUP_SIZE 1048576 for block pressure.

control substitution on


statement ok
ATTACH '${__TEST_DIR__}/ctv_wide.db' AS cw (TYPE duckdb, STORAGE_VERSION 'serenedb_v1', ROW_GROUP_SIZE 1048576);


statement ok
ATTACH '${__TEST_DIR__}/ctv_vac.db' AS cv (TYPE duckdb, STORAGE_VERSION 'serenedb_v1');


statement ok
CREATE TYPE cw.mood AS ENUM ('ok', 'warn', 'crit', 'dead');


# UUID twice: u2 is pure sequential-hex (bitpacking-friendly int128 deltas); u adds ONE far-off
# value, which de-bitpacks the ENTIRE single-row-group column -- one outlier costs the codec, and
# both directions are pinned below. ENUM rides its small integer index alongside.
statement ok
CREATE TABLE cw.uuid_enum AS
  SELECT ord,
         CASE WHEN ord = 580000 THEN 'ffffffff-ffff-4fff-8fff-ffffffffffff'::UUID
              ELSE ('00000000-0000-4000-8000-' || lpad(to_hex(ord), 12, '0'))::UUID END AS u,
         ('00000000-0000-4000-8000-' || lpad(to_hex(ord), 12, '0'))::UUID AS u2,
         (['ok','warn','crit','dead'][1 + ord % 4])::cw.mood AS m
  FROM range(600000) t(ord) ORDER BY ord;


statement ok
CHECKPOINT cw;


statement ok
SET force_compression='dict_fsst';


# STRUCT: the `name` field carries unique digests with a flip every ~900 rows, `kind` is low-card;
# MAP: low-card keys against mixed unique/duplicate values -- four independent VARCHAR child trees
statement ok
CREATE TABLE cw.struct_map AS
  SELECT ord,
         {'name': CASE WHEN ord % 900 < 800 THEN md5(ord::VARCHAR) ELSE 'flip' END,
          'kind': 'k' || (ord % 30)::VARCHAR} AS st,
         MAP(['a', 'b'], [md5((ord * 3)::VARCHAR), 'v' || (ord % 20)::VARCHAR]) AS mp
  FROM range(120000) t(ord) ORDER BY ord;


statement ok
CHECKPOINT cw;


# vacuum: 600k rows over 5 default-size row groups, checkpointed once, then 91% deleted and
# checkpointed again -- the survivors are recompressed through the same cut machinery
statement ok
CREATE TABLE cv.vac AS
  SELECT ord, 'g' || lpad((ord // 8)::VARCHAR, 7, '0') || md5(ord::VARCHAR) AS v
  FROM range(600000) t(ord) ORDER BY ord;


statement ok
CHECKPOINT cv;


query
SELECT count(DISTINCT row_group_id) AS rgs_before FROM pragma_storage_info('cv.vac', include_segment_info=true);
----
rgs_before
5


statement ok
DELETE FROM cv.vac WHERE ord % 10 != 0 OR (ord >= 300000 AND ord < 400000);


statement ok
CHECKPOINT cv;


statement ok
SET force_compression='auto';


# the merge happened and the survivors are intact to the byte
query
SELECT count(DISTINCT row_group_id) AS rgs_after FROM pragma_storage_info('cv.vac', include_segment_info=true);
----
rgs_after
1


query
SELECT 'struct_map' AS shape, count(*) AS n,
       bool_and(st = {'name': CASE WHEN ord % 900 < 800 THEN md5(ord::VARCHAR) ELSE 'flip' END,
                      'kind': 'k' || (ord % 30)::VARCHAR}
            AND mp = MAP(['a', 'b'], [md5((ord * 3)::VARCHAR), 'v' || (ord % 20)::VARCHAR])) AS rows_match
  FROM cw.struct_map
UNION ALL SELECT 'uuid_enum', count(*),
       bool_and(u = CASE WHEN ord = 580000 THEN 'ffffffff-ffff-4fff-8fff-ffffffffffff'::UUID
                    ELSE ('00000000-0000-4000-8000-' || lpad(to_hex(ord), 12, '0'))::UUID END
            AND u2 = ('00000000-0000-4000-8000-' || lpad(to_hex(ord), 12, '0'))::UUID
            AND m = (['ok','warn','crit','dead'][1 + ord % 4])::cw.mood)
  FROM cw.uuid_enum
UNION ALL SELECT 'vac', count(*),
       bool_and(v = 'g' || lpad((ord // 8)::VARCHAR, 7, '0') || md5(ord::VARCHAR))
  FROM cv.vac
ORDER BY shape;
----
shape	n	rows_match
struct_map	120000	t
uuid_enum	600000	t
vac	50000	t


# exactly the intended survivors: every tenth ord outside the deleted band
query
SELECT min(ord) AS lo, max(ord) AS hi, count(*) FILTER (ord >= 300000 AND ord < 400000) AS band_left
  FROM cv.vac;
----
lo	hi	band_left
0	599990	0


# codec placement across the whole file: clean sequential UUIDs bitpack while ONE outlier
# de-bitpacks the whole row group (both pinned), ENUM bitpacks, all four nested VARCHAR children
# (struct.name, struct.kind, map.key, map.value) landed in DICT_FSST, and the vacuumed survivors
# were RE-compressed into DICT_FSST after the merge
query
SELECT 'uuid_clean_bitpacks' AS combo, (SELECT bool_or(compression = 'BitPacking') FROM pragma_storage_info('cw.uuid_enum', include_segment_info=true) WHERE column_name='u2' AND segment_type NOT IN ('VALIDITY')) AS ok
UNION ALL SELECT 'uuid_spike_debitpacks', (SELECT NOT bool_or(compression = 'BitPacking') FROM pragma_storage_info('cw.uuid_enum', include_segment_info=true) WHERE column_name='u' AND segment_type NOT IN ('VALIDITY'))
UNION ALL SELECT 'enum_bitpacks', (SELECT bool_or(compression = 'BitPacking') FROM pragma_storage_info('cw.uuid_enum', include_segment_info=true) WHERE column_name='m' AND segment_type NOT IN ('VALIDITY'))
UNION ALL SELECT 'struct_children_dict_fsst', (SELECT count(DISTINCT column_path) = 2 FROM pragma_storage_info('cw.struct_map', include_segment_info=true) WHERE column_name='st' AND segment_type='VARCHAR' AND compression='DICT_FSST')
UNION ALL SELECT 'map_children_dict_fsst', (SELECT count(DISTINCT column_path) = 2 FROM pragma_storage_info('cw.struct_map', include_segment_info=true) WHERE column_name='mp' AND segment_type='VARCHAR' AND compression='DICT_FSST')
UNION ALL SELECT 'vacuumed_dict_fsst', (SELECT bool_or(compression = 'DICT_FSST') FROM pragma_storage_info('cv.vac', include_segment_info=true) WHERE column_name='v' AND segment_type='VARCHAR')
ORDER BY combo;
----
combo	ok
enum_bitpacks	t
map_children_dict_fsst	t
struct_children_dict_fsst	t
uuid_clean_bitpacks	t
uuid_spike_debitpacks	t
vacuumed_dict_fsst	t


statement ok
DETACH cw;


statement ok
DETACH cv;
